title,lokasi,harga,kamar_tidur,luas_bangunan_m2,luas_tanah_m2
dijual cepat rumah cantik di perumahan legenda wisata Cibubur,"Legenda Wisata, Jakarta Timur",Rp2.400.000.000,5,250 m²,255 m²
"MURAH  Rumah Jl Kebon Kacang, cocok untuk kost2an, Dekat GI/PI.",Jakarta Pusat,Rp2.000.000.000,2,100 m²,75 m²
Dijual Rumah Town House Depan Mall Bassura Dekat Akses Tol Bypass,"Cipinang, Jakarta Timur",Rp4.650.000.000,4,180 m²,174 m²
DiJual  Rumah di Komplek Pati TNI AD,Jakarta Timur,Rp10.000.000.000,6,657 m²,200 m²
Rumah Strategis di Jakarta Selatan,Jakarta Selatan,Rp1.750.000.000,4,100 m²,137 m²
"Dijyal rumah di Cipete, pinggir jalan raya, cocok buat komersil.","Cipete, Jakarta Selatan",Rp39.800.000.000,4,400 m²,1084 m²
Expert Project Garden Exclusive-Rumah Cantik Mewah di Jakarta Timur,"Cakung, Jakarta Timur",Rp3.324.000.000,4,115 m²,120 m²
"Jl.Wijaya 1, Kebayoran baru, Jakarta Selatan. Lokasi daerah Komersial","Kebayoran Baru, Jakarta Selatan",Rp25.000.000.000,6,300 m²,424 m²
Dijual Rumah Bagus Siap Huni di Villa Bukit Mas,"Pesanggrahan, Jakarta Selatan",Rp4.900.000.000,4,700 m²,345 m²
HUNIAN MEWAH PARA SULTAN KONSEP LUXURY RESIDENCE DI PUSAT KOTA JAKARTA,"Kebayoran Lama, Jakarta Selatan",Rp2.875.150.000,5,220 m²,87 m²
"Dijual Cepat, Harga Nego, Semi Furnish, Siap Huni","Pantai Indah Kapuk, Jakarta Utara",Rp1.450.000.000,2,45 m²,45 m²
"Fasilitas Lingkungan Lengkap, Siap Huni, Akses Jalan Mudah","Pantai Indah Kapuk, Jakarta Utara",Rp3.900.000.000,3,160 m²,120 m²
"Rumah Villa Gading Indah, Kelapa Gading Luas 592m2 (J-3194)","Kelapa Gading, Jakarta Utara",Rp23.000.000.000,5,450 m²,592 m²
Dijual Rumah Murah Hook 2 Lantai Siap Huni Di Grand Cibubur Country,"Cibubur, Jakarta Timur",Rp1.700.000.000,4,165 m²,169 m²
Dijual Rumah Tingkat Siap Huni Dalam Cluster Premium,"Cibubur, Jakarta Timur",Rp1.195.000.000,4,110 m²,120 m²
Rumah Rapi di Cluster Green Lake City,Jakarta Utara,Rp2.300.000.000,3,120 m²,90 m²
Jual Rumah di Pondok Kelapa Baru 2 Lantai Jakarta,Jakarta Timur,Rp1.581.920.000,3,77 m²,63 m²
"Fasilitas Perumahan Lengkap, Akses Tol Dekat, Brand New","Pantai Indah Kapuk, Jakarta Utara",Rp3.700.000.000,3,181 m²,80 m²
Rumah Muara Karang 8x15 Full Furnished 2 setengah lantai SHM,"Muara Karang, Jakarta Utara",Rp4.000.000.000,4,200 m²,120 m²
Dijual Rumah Tua Di Joglo Kembangan Jakarta Barat,"Kembangan, Jakarta Barat",Rp3.000.000.000,3,120 m²,272 m²
MILIKI HUNIAN BERDESAIGN ELEGAN DI JAKARTA SELATAN,"Pesanggrahan, Jakarta Selatan",Rp3.350.000.000,4,171 m²,70 m²
TINGGAL BEBERAPA UNIT  RUMAH MEWAH 700 JUTAAN STRATEGIS DI JATIASIH,"Jatinegara, Jakarta Timur",,3,90 m²,78 m²
PERHATIAN! Cluster Mewah & Murah Strategis Jatimekar Jatiasih,"Sawah Besar, Jakarta Pusat",,2,40 m²,71 m²
WD - 23397 Dijual Rumah Asri Mewah Di Komplek Ikip Duren Sawit JakTim,"Duren Sawit, Jakarta Timur",Rp12.000.000.000,3,600 m²,630 m²
Dijual Rumah Baru Pejaten Barat,"Pejaten Barat, Jakarta Selatan",Rp9.500.000.000,5,350 m²,210 m²
"LELANG TANAH Rumah  965m Elegan, Jaksel Martimbang Gunung Kebayoran","Kebayoran Baru, Jakarta Selatan",Rp54.750.000.000,5,500 m²,965 m²
dijual cepat rumah cantik di perumahan legenda wisata Cibubur,"Legenda Wisata, Jakarta Timur",Rp2.400.000.000,5,250 m²,255 m²
Rumah murah siap huni SHM dalam perumahan di joglo jakarta,"Joglo, Jakarta Barat",Rp1.725.000.000,4,88 m²,64 m²
DI JUAL RUMAH JAKARTA BARAt,"Kemanggisan, Jakarta Barat",Rp2.300.000.000,5,172 m²,153 m²
New Samara Village,"Kebon Jeruk, Jakarta Barat",Rp1.942.600.000,3,79 m²,97 m²
Rumah di PIk Ukuran 18 x 27,"Pantai Indah Kapuk, Jakarta Utara",Rp22.000.000.000,5,700 m²,486 m²
Dijual Rumah di Jl. Cipete 7,"Cipete, Jakarta Selatan",Rp17.500.000.000,6,500 m²,585 m²
Dijual Rumah di Patra Kuningan,"Kuningan, Jakarta Selatan",Rp80.000.000.000,7,400 m²,1200 m²
Jual Rumah Hang Lekiu 2 type 5 BR With Swimming Pool,"Kebayoran Baru, Jakarta Selatan",Rp30.000.000.000,5,600 m²,329 m²
"Rumah Bagus & Asri, Ampera Area","Ampera, Jakarta Selatan",Rp20.000.000.000,5,750 m²,800 m²
"Rumah Di Komplek Dutamas - 3BR, 3.5m, Jelambar, Jakarta Barat","Jelambar, Jakarta Barat",Rp3.500.000.000,3,112 m²,147 m²
Bukit Podomoro Jakarta,"Duren Sawit, Jakarta Timur",Rp4.300.000.000,3,146 m²,90 m²
"Rumah 2 lantai dalam cluster di Cakung, jakarta timur",Jakarta Timur,Rp2.800.000.000,5,168 m²,119 m²
Di jual rumah bagus di Menteng Dalam,"Menteng Dalam, Jakarta Selatan",Rp6.500.000.000,4,180 m²,237 m²
RUMAH 2 LANTAI SIAP HUNI DI JAGAKARSA,"Jagakarsa, Jakarta Selatan",Rp1.450.000.000,4,130 m²,76 m²
Rumah 2 lantai siap huni di Jagakarsa jaksel,"Jagakarsa, Jakarta Selatan",Rp19.000.000.000,5,650 m²,1040 m²
Dijual Cepat Rumah Baru di PIK 2,"Pantai Indah Kapuk, Jakarta Utara",Rp4.300.000.000,4,160 m²,120 m²
Dijual Rumah Di Tanjung Priok 2 Lt  Dekat Kantor Walikota,"Kebon Bawang, Jakarta Utara",Rp2.200.000.000,5,274 m²,132 m²
Brand New Dijual Town house Modern Area Cilandak Jaksel,"Cilandak, Jakarta Selatan",Rp7.195.000.000,3,254 m²,151 m²
Rumah Asri Dalam Komplek Cilandak,"Cilandak, Jakarta Selatan",Rp14.500.000.000,5,700 m²,1060 m²
Rumah Modern Minimalis dan Mewah di Cilandak,"Cilandak, Jakarta Selatan",Rp8.500.000.000,3,433 m²,157 m²
"Rumah Mediterania Boulevard Pik luas 250m2 Hrg 10,5M hadap utara","Pantai Indah Kapuk, Jakarta Utara",Rp10.500.000.000,4,600 m²,250 m²
Jual Rumah di Pondok Kelapa Duren Sawit Baru,Jakarta Timur,Rp1.581.920.000,3,77 m²,63 m²
Rumah di Bangka Raya Kemang Bebas Banjir,"Bangka, Jakarta Selatan",Rp19.800.000.000,4,580 m²,780 m²
Rumah Baru Lokasi Strategis Bebas banjir Duri Kepa(DK213),"Duri Kepa, Jakarta Barat",Rp1.230.000.000,3,110 m²,36 m²
Rumah siap huni di Pondok Kelapa,"Pondok Kelapa, Jakarta Timur",Rp1.990.000.000,4,180 m²,92 m²
Di Jual Rumah Minimalis Modern Lokasi Dekat Pintu Toll Dan LRT,"Cibubur, Jakarta Timur",Rp799.000.000,2,50 m²,75 m²
Rumah Klasik di jakarta timur dekat LRT Harjamukti Free biaya biaya,"Cibubur, Jakarta Timur",Rp989.514.240,3,60 m²,72 m²
JUAL RUMAH HOEK DI SUNRISE GARDEN JAKARTA BARAT. MURAH,"Kebon Jeruk, Jakarta Barat",Rp6.500.000.000,4,350 m²,280 m²
"DIJUAL RUMAH SIAP HUNI DI KAWASAN SENAYAN, KOMPLEK PLN","Senayan, Jakarta Selatan",Rp12.500.000.000,4,279 m²,283 m²
dijual lelang rumah di petukangan jaksel,"Petukangan, Jakarta Selatan",Rp2.000.000.000,3,1 m²,212 m²
Dijual 2 unit rumah brand new Deplu Adam Malik Jakarta Selatan,"Petukangan, Jakarta Selatan",Rp2.500.000.000,4,196 m²,126 m²
"Rumah Di Tebet Di Jual, Butuh Uang Cepat","Tebet Barat, Jakarta Selatan",Rp3.150.000.000,5,200 m²,140 m²
DIJUAL CEPAT! Rumah Mewah 2 Lantai Siap Huni Area Cilandak Jak-Sel,"Cilandak, Jakarta Selatan",Rp10.000.000.000,8,650 m²,650 m²
Rumah Murah Di Bintaro Selatan Jakarta Tanpa Bank Tanpa Bi Cheking,"Bintaro, Jakarta Selatan",Rp596.000.000,2,38 m²,61 m²
7x15. Minimalis. Bagus. Hadap Utara.,"Sunter Agung, Jakarta Utara",Rp3.800.000.000,3,168 m²,105 m²
Rumah Standar Siap Huni Di Pulo Mas Jakarta Timur,"Pulo Gadung, Jakarta Timur",Rp3.150.000.000,6,179 m²,148 m²
Rumah Tua Di Kelapa Gading Jakarta Utara,"Kelapa Gading, Jakarta Utara",Rp2.000.000.000,3,180 m²,120 m²
★ ADA ROOFTOP GARDEN BUAT ENJOY SUNSET ★ Rumah Kemang - Mampang,"Mampang Prapatan, Jakarta Selatan",Rp4.900.000.000,4,335 m²,127 m²
Grand launching cluster 4 lantai di gunung Sahari,"Gunung Sahari, Jakarta Pusat",Rp1.249.000.000,3,90 m²,27 m²
Di jual rumah paling bagus paling murah di Johar baru Jakarta pusat,"Johar Baru, Jakarta Pusat",Rp275.000.000,2,22 m²,22 m²
"Jual Kantor, Rumah, Gudang Murah Dibawah Njop Rp. 7.99 M Di Letjend Suprapto","Cempaka Putih, Jakarta Pusat",Rp9.300.000.000,4,300 m²,337 m²
Dijual Rumah lokasi strategis di Bumi Pesanggrahan Mas Jakarta Selatan,"Petukangan, Jakarta Selatan",Rp2.900.000.000,3,300 m²,200 m²
"Rumah Minimalis Murah Petukangan, Kreo, Joglo, Larangan","Petukangan, Jakarta Selatan",Rp685.000.000,2,40 m²,32 m²
"Rumah Mampang Prapatan Dijual - Dekat ke Tendean, SCBD - Unit Baru","Mampang Prapatan, Jakarta Selatan",Rp4.800.000.000,6,250 m²,110 m²
Rumah Mewah Design Industrial Modern Dalam Komplek Petukangan Jaksel,"Petukangan, Jakarta Selatan",Rp8.350.000.000,4,320 m²,320 m²
Cibubur Jakarta Timur Rumah Raffles Hills Cibubur di Jual Cepat,Jakarta Timur,Rp6.500.000.000,4,250 m²,300 m²
Rumah Tingkat di Taman Modern Cakung Jakarta Timur,"Cakung, Jakarta Timur",Rp2.200.000.000,6,300 m²,200 m²
DHYANA RUMAH JELAMBAR UK 3.3x12m BANGUNAN KOKOH SERTIFIKAT SHM,"Jelambar, Jakarta Barat",Rp625.000.000,3,66 m²,38 m²
Rumah Tua Di Kelapa Gading Jakarta Utara,"Kelapa Gading Barat, Jakarta Utara",Rp1.300.000.000,2,90 m²,112 m²
dijual cepat rumah cantik di perumahan legenda wisata Cibubur,"Legenda Wisata, Jakarta Timur",Rp1.900.000.000,4,150 m²,171 m²
Turun Harga Rumah Standard di Kelapa Lilin,"Kelapa Gading, Jakarta Utara",Rp1.850.000.000,3,85 m²,102 m²
TINGGAL BEBERAPA UNIT  RUMAH MEWAH 700 JUTAAN STRATEGIS DI JATIASIH,"Jatinegara, Jakarta Timur",,3,90 m²,78 m²
"Di Jual Rumah di kawasan Jagakarsa, JakSel","Jagakarsa, Jakarta Selatan",Rp2.700.000.000,4,270 m²,182 m²
Dijual Rumah Mewah Fully Furnished di Mediterania Resort,"Pantai Indah Kapuk, Jakarta Utara",Rp35.000.000.000,7,800 m²,525 m²
Rumah Siap Huni Jakarta Selatan,Jakarta Selatan,Rp22.000.000.000,5,600 m²,1055 m²
"For sale Brand new Townhouse Kemang Six Residence (AK, JP, LP, FF)",Jakarta Selatan,Rp12.000.000.000,4,430 m²,330 m²
RUMAH SANGAT LAYAK HUNI WILAYAH JL KEBALEN JAKARTA SELATAN STRATEGIS,"Mampang Prapatan, Jakarta Selatan",Rp3.350.000.000,4,300 m²,150 m²
Dijual Tempat Usaha LT 288 m2 Strategis Salembaba Jakarta Pusat,"Senen, Jakarta Pusat",Rp13.900.000.000,5,200 m²,288 m²
"Rumah Meruya  Utara, Di Jual 6M sebelumnya 9M","Meruya Utara, Jakarta Barat",Rp6.000.000.000,5,425 m²,415 m²
"Rumah 2 Lt, Bagus Kekinian Siap Huni 100",Jakarta Selatan,Rp3.300.000.000,6,350 m²,500 m²
FOR SALE KEBAYORAN BARU BRAND NEW HOUSE LUXURIOUS AMERICAN CLASSIC,"Kebayoran Baru, Jakarta Selatan",Rp37.000.000.000,6,800 m²,375 m²
Dijual Rumah 3 lantai Full Renovasi dalam Cluster di Jakarta Garden Ci,"Cakung, Jakarta Timur",Rp2.500.000.000,3,150 m²,106 m²
Rumah L7 Jakarta Barat,"Semanan, Jakarta Barat",Rp3.250.000.000,5,166 m²,140 m²
Rumah Rooftop Murah dengan Pemandangan Taman Bunga yang Menakjubkan,"Cibubur, Jakarta Timur",Rp639.000.000,2,47 m²,45 m²
"Rumah Hook di Kemanggisan Slipi, Strategis Untuk Rumah Dan Usaha","Palmerah, Jakarta Barat",Rp6.500.000.000,3,240 m²,260 m²
Bangka t750m2 Kemang Bebas Banjir Rumah Dijual Jakarta Selatan,"Bangka, Jakarta Selatan",Rp16.000.000.000,5,500 m²,750 m²
chandra Rumah 2 lantai uk 12x16.5m di jelambar,"Jelambar, Jakarta Barat",Rp4.300.000.000,5,310 m²,198 m²
Rumah Baru Siap Huni Bebas Banjir Tanjung Duren(TD236),"Tanjung Duren, Jakarta Barat",Rp1.850.000.000,3,72 m²,39 m²
Rumah Siap Huni bebas Banjir Di Duri Kepa DK203,"Duri Kepa, Jakarta Barat",Rp1.400.000.000,3,100 m²,78 m²
Dijual Cepat !! Rumah PIK elang laut residence bagus rapi siap huni,"Pantai Indah Kapuk, Jakarta Utara",Rp11.500.000.000,4,620 m²,259 m²
Rumah L6 JAKARTA BARAT,Jakarta Barat,Rp2.750.000.000,3,136 m²,120 m²
"Perumahan Syariah Termurah di Cibubur Jakarta Timur, 10 Menit ke Toll","Cibubur, Jakarta Timur",Rp989.514.240,3,60 m²,72 m²
Di Jua Cepat Villa Dekat Dengan Taman Safari,"Kembangan, Jakarta Barat",Rp11.000.000.000,5,400 m²,2315 m²
"Jual Cepat Rumah Klasik Mewah di Bangka Kemang Jaksel, Hrg Nego","Bangka, Jakarta Selatan",Rp19.500.000.000,4,950 m²,738 m²
Chandra rumah 3 lantai uk 4.5x15m surat shm di jelambar,"Jelambar, Jakarta Barat",Rp1.850.000.000,3,141 m²,67 m²
Chandra rumah lama lt 526m2 strategis di komplek kavling polri,"Jelambar, Jakarta Barat",Rp13.000.000.000,5,738 m²,526 m²
Chandra rumah 2.5 lantai uk 4x15m hadap selatan komplek kavling polri,"Jelambar, Jakarta Barat",Rp1.690.000.000,2,102 m²,60 m²
Jual Rumah 3 menit dari toll Cibubur,"Cibubur, Jakarta Timur",Rp1.860.000.000,3,135 m²,111 m²
DI JUAL RUMAH MEWAH KAWASAN UTAN PANJANG KEMAYORAN,"Utan Panjang, Jakarta Pusat",Rp10.000.000.000,19,700 m²,455 m²
Rumah Baru Siap Huni Jalan 2 mobil di Tanjung Duren(TD212),"Tanjung Duren, Jakarta Barat",Rp2.000.000.000,3,108 m²,52 m²
Dijual Rumah PIK Camar permai 9x29 sudah renovasi rapi siap huni,"Pantai Indah Kapuk, Jakarta Utara",Rp8.700.000.000,4,450 m²,261 m²
Rumah Baru bebas banjir Di Duri Kepa(DK220),"Duri Kepa, Jakarta Barat",Rp2.300.000.000,5,180 m²,80 m²
Di jual Cepat Rumah 2Lantai Cluster Jura Metland Menteng,"Ujung Menteng, Jakarta Timur",Rp2.000.000.000,2,69 m²,96 m²
"Dijual Cepat Siap Huni BU Rumah Citra Garden 2 Ext, Kalideres. JakBar","Kalideres, Jakarta Barat",Rp1.900.000.000,3,93 m²,115 m²
Rumah TGT Jakarta Utara Teluk Gong Dijual Murah 4.5x15,"Teluk Gong, Jakarta Utara",Rp1.300.000.000,4,120 m²,67 m²
Rumah Mewah Baru Renovasi Dalam Komplek Klender Jakarta Timur,"Duren Sawit, Jakarta Timur",Rp5.200.000.000,6,350 m²,278 m²
Rumah Free Bphtb Dan ajb Dekat Sekolah Regina Caeli,"Cibubur, Jakarta Timur",Rp945.000.000,2,48 m²,72 m²
"Rumah Di Jual Di Citra Garden, Cluster, dekat ke Tol, nyaman.",Jakarta Barat,Rp6.850.000.000,5,452 m²,210 m²
Dijual Rumah Asri Siap Huni,"Kembangan, Jakarta Barat",Rp10.000.000.000,4,400 m²,230 m²
Rumah termewah modern harga murah di pondok labu andara,"Pondok Labu, Jakarta Selatan",Rp3.913.000.000,5,250 m²,119 m²
Rumah lama hitung tanah    Benhil raya Jakarta pusat,"Bendungan Hilir, Jakarta Pusat",Rp15.000.000.000,4,200 m²,281 m²
Dijual Rumah Siap Huni Di Jagakarsa Cocok Juga Untuk Investasi (Nego),"Jagakarsa, Jakarta Selatan",Rp9.000.000.000,4,334 m²,607 m²
Rumah Siap Huni Kelapa Gading Jakarta Utara Bisa Nego,"Kelapa Gading, Jakarta Utara",Rp4.000.000.000,4,240 m²,180 m²
"Rumah Mewah 3 Lantai, Semi Furnish, lokasi strategis di Jakarta Barat.",Jakarta Barat,Rp3.500.000.000,5,250 m²,117 m²
Dijual Cepat Rumah Cantik Dekat Cibubur Juction,"Cibubur, Jakarta Timur",Rp3.900.000.000,4,400 m²,200 m²
Townhouse Privat Minimalis Strategis Dekat Mall & LRT Cibubur,"Cibubur, Jakarta Timur",Rp896.000.000,3,74 m²,56 m²
dijual rumah ready siap huni di jagakarsa jakarta selatan,"Jagakarsa, Jakarta Selatan",Rp1.750.000.000,4,135 m²,89 m²
Dijual Rumah 3 Lantai di Jalan Kebembem Jagakarsa Lokasi Strategis,"Jagakarsa, Jakarta Selatan",Rp1.400.000.000,4,150 m²,60 m²
Dijual Rumah Garden House PIK,"Pantai Indah Kapuk, Jakarta Utara",Rp11.000.000.000,4,500 m²,250 m²
Dijual Rumah Tinggal Siap Huni di Jakarta Barat (HARGA NEGO),"Kebon Jeruk, Jakarta Barat",Rp9.000.000.000,4,350 m²,390 m²
Rumah Di Cluster New Forster Berada Dalam Kawasan 160 Hektar Shm,"Cibubur, Jakarta Timur",Rp2.500.000.000,4,132 m²,140 m²
Rumah LUX Kemang,"Mampang Prapatan, Jakarta Selatan",Rp10.000.000.000,4,425 m²,225 m²
FOR SALE MODERN CLASSIC HOUSE,Jakarta Selatan,Rp10.000.000.000,4,400 m²,240 m²
Dijual rumah cantik dan modern dua lantai di Pemuda Jakarta Timur,"Cempaka Putih, Jakarta Pusat",Rp1.477.000.000,3,67 m²,48 m²
Jagakarsa rumah pas pinggir jalan raya dg kolam renang pribadi,Jakarta Selatan,Rp7.288.888.888,5,450 m²,610 m²
Dijual rumah jl. Cendrawasih Bintaro Sektor 1 JakSel,"Bintaro, Jakarta Selatan",Rp6.900.000.000,4,300 m²,300 m²
DIJUAL RUMAH PERMATA BUANA GAYA MINIMALIS MODERN,"Kembangan Utara, Jakarta Barat",Rp5.000.000.000,3,140 m²,144 m²
Lenteng Agung Jalan Joe Kelapa Tiga Ada Bangunan Rumah,"Jagakarsa, Jakarta Selatan",Rp2.500.000.000,4,100 m²,190 m²
Rumah Tapak Rasa Apartemen Di Matraman Jakarta,"Matraman, Jakarta Timur",Rp535.000.000,2,46 m²,23 m²
"Rumah Kelapa Gading - Skandinavia, Unit Baru - Dalam Komplek","Kelapa Gading Barat, Jakarta Utara",Rp1.600.000.000,3,94 m²,60 m²
DIJUAL RUMAH BARU MEWAH Di Taman Kedoya Jakarta barat,"Kedoya, Jakarta Barat",Rp27.900.000.000,7,750 m²,625 m²
"Dijual Cepat Rumah Muara Karang Blok 8, Siap huni, Rapih, Hadap Timur!","Muara Karang, Jakarta Utara",Rp7.000.000.000,3,300 m²,200 m²
DIJUAL RUMAH CLUSTER TYPE C METLAND MENTENG JAKARTA TIMUR,"Ujung Menteng, Jakarta Timur",Rp4.800.000.000,3,146 m²,200 m²
Rumah Mewah 2 Lantai Di Dalam Komplek Perumahan Cempaka Putih Barat,"Cempaka Putih, Jakarta Pusat",Rp1.133.000.000,2,62 m²,32 m²
RUMAH 3 LANTAI LOKASI STRATEGIS DI METLAND MENTENG,Jakarta Timur,Rp1.900.000.000,3,88 m²,70 m²
Dijual Rumah Mewah &Antik di Cempaka Mas Jakarta Pusat,Jakarta Pusat,Rp10.000.000.000,7,301 m²,293 m²
Dijual Cepat Citra Garden 6,"Pegadungan, Jakarta Barat",Rp12.800.000.000,4,100 m²,247 m²
"Jual Rumah Cluster Alamanda Sudah Renov, JGC Jakarta Timur","Cakung, Jakarta Timur",Rp4.500.000.000,3,156 m²,278 m²
Dijual cepat  rumah tua hitung tanah  di Rawamangun Jakarta timur,Jakarta Timur,Rp4.900.000.000,4,135 m²,233 m²
Rumah  minimalis modern di jalan pemuda Rawamangun Jakarta timur,"Rawamangun, Jakarta Timur",Rp1.329.300.000,3,67 m²,48 m²
Jual cepat rumah di cluster yarra JGC Jakarta Garden City,"Cakung Timur, Jakarta Timur",Rp1.600.000.000,5,50 m²,90 m²
"JUAL RUMAH CLUSTER NORTH THAMES, JAKARTA GARDEN CITY","Cakung Timur, Jakarta Timur",Rp1.800.000.000,4,75 m²,102 m²
"Jual Murah Cepat Rumah di Taman Modern cakung, 220 m² jalan utama","Ujung Menteng, Jakarta Timur",Rp2.800.000.000,6,200 m²,220 m²
"JUAL RUMAH 2LANTAI CLUSTER ASYA SEMAYANG, JAKARTA GARDEN CITY","Cakung Timur, Jakarta Timur",Rp5.000.000.000,5,147 m²,168 m²
"Dijual Rumah di Cendrawasih, Cengkareng Barat , Jakarta Barat.","Cengkareng Barat, Jakarta Barat",Rp860.000.000,2,72 m²,48 m²
DI JUAL RUMAH BANGUNAN LAMA KAWASAN KEBON BARU TEBET,Jakarta Selatan,Rp12.000.000.000,8,600 m²,775 m²
Dijual Rumah Pik2 uk 6x12.5 Semi Furnish Termurah,Jakarta Utara,Rp2.400.000.000,3,90 m²,75 m²
DI JUAL RUMAH BANGUNAN LAMA KAWASAN MANDALA CILILITAN,Jakarta Timur,Rp10.000.000.000,3,350 m²,605 m²
Rumah Mewah Luas Full Furnished di Legenda Wisata dekat Tol,"Legenda Wisata, Jakarta Timur",Rp2.350.000.000,4,140 m²,180 m²
Dijual Rumah Di Tanjung Duren Jakarta Barat,"Tanjung Duren, Jakarta Barat",Rp1.300.000.000,3,60 m²,37 m²
Rumah Mewah Dekat Universitas UNJ Rawamangun Jakarta timur,"Utan Kayu, Jakarta Timur",Rp1.300.000.000,3,67 m²,48 m²
"Expert Project Brezza, New House 3 Lantai Di Jakarta Utara","Penjaringan, Jakarta Utara",Rp5.000.000.000,3,240 m²,129 m²
termurah rumah di pondok indah,Jakarta Selatan,Rp48.000.000.000,5,1050 m²,627 m²
Rumah TGU Brand New Teluk gong Dijual 5x15,"Teluk Gong, Jakarta Utara",Rp2.900.000.000,3,300 m²,75 m²
JUAL RUMAH 2 LANTAI CLUSTER SHINANO JAKARTA GARDEN CITY,Jakarta Timur,Rp2.200.000.000,4,69 m²,90 m²
"Dijual Cepat Siap Huni BU Rumah Teluk Gong, Penjaringan. Jakarta Utara","Teluk Gong, Jakarta Utara",Rp3.000.000.000,4,90 m²,90 m²
Rumah VKT Jakarta Utara Kapuk Muara Dijual Murah  5x16,"Penjaringan, Jakarta Utara",Rp1.900.000.000,4,280 m²,80 m²
"Rumah lama, Lokasi bagus","Kebayoran Baru, Jakarta Selatan",Rp19.500.000.000,4,300 m²,450 m²
Rumah Siap Huni Taman Palem,Jakarta Barat,Rp1.100.000.000,3,60 m²,55 m²
Dijual Rumah di Raffles Hills Depok Bebas Banjir Siap Nego KPR J-17264,"Cibubur, Jakarta Timur",Rp3.110.000.000,4,156 m²,160 m²
Rumah Baru Mewah Classic Eropa   NEGO,"Mampang Prapatan, Jakarta Selatan",Rp11.250.000.000,6,607 m²,247 m²
JUAL RUMAH 2 LANTAI MEWAH CLUSTER WISTERIA ANTHIA JGC,Jakarta Timur,Rp4.500.000.000,4,144 m²,176 m²
Dijual rumah jl. Cendrawasih Bintaro Sektor 1 JakSel,"Bintaro, Jakarta Selatan",Rp6.900.000.000,4,300 m²,300 m²
Dijual Rumah Siap Huni Di Jagakarsa Cocok Juga Untuk Investasi (Nego),"Jagakarsa, Jakarta Selatan",Rp9.000.000.000,4,334 m²,607 m²
FOR SALE KEBAYORAN BARU BRAND NEW HOUSE LUXURIOUS AMERICAN CLASSIC,"Kebayoran Baru, Jakarta Selatan",Rp37.000.000.000,6,800 m²,375 m²
Rumah L7 Jakarta Barat,"Semanan, Jakarta Barat",Rp3.250.000.000,5,166 m²,140 m²
"Rumah 2 Lt, Bagus Kekinian Siap Huni 100",Jakarta Selatan,Rp3.300.000.000,6,350 m²,500 m²
Dijual Rumah 3 lantai Full Renovasi dalam Cluster di Jakarta Garden Ci,"Cakung, Jakarta Timur",Rp2.500.000.000,3,150 m²,106 m²
RUMAH SANGAT LAYAK HUNI WILAYAH JL KEBALEN JAKARTA SELATAN STRATEGIS,"Mampang Prapatan, Jakarta Selatan",Rp3.350.000.000,4,300 m²,150 m²
"Rumah Meruya  Utara, Di Jual 6M sebelumnya 9M","Meruya Utara, Jakarta Barat",Rp6.000.000.000,5,425 m²,415 m²
Dijual Rumah Mewah 3 Lantai di Cengkareng Jakarta Barat tanpa DP 0%,"Cengkareng, Jakarta Barat",Rp1.800.000.000,4,86 m²,68 m²
Dijual Rumah Mewah Murah Strategis Kolam Renang Di Bintaro Jaksel,Jakarta Selatan,Rp14.000.000.000,5,263 m²,500 m²
Rumah 2 Lantai Dijual di Park Residence Bebas Banjir Siap KPR J-20012,"Kalideres, Jakarta Barat",Rp1.400.000.000,2,80 m²,55 m²
Rumah Cipete Selatan,"Cipete Selatan, Jakarta Selatan",Rp11.500.000.000,5,400 m²,453 m²
"Expert Project Garden Exclusive-Rumah mewah 3,5 lantai di Jakarta","Cakung, Jakarta Timur",Rp1.967.000.000,3,63 m²,75 m²
jual cepat rumah legenda wisata cibubur dekat tol kota wisata,"Cibubur, Jakarta Timur",Rp1.300.000.000,3,100 m²,126 m²
"Kamar Master Di Bawah, Halaman Besar, Carport Bisa 10 Mobil","Kebayoran Lama, Jakarta Selatan",Rp15.000.000.000,3,400 m²,1070 m²
Rumah Cempaka Putih Jakarta Pusat,"Cempaka Putih, Jakarta Pusat",Rp13.500.000.000,5,513 m²,644 m²
RUMAH DIJUAL DI CILANDAK LUAS DAN ASRI BISA NEGO,"Cilandak, Jakarta Selatan",Rp18.000.000.000,9,570 m²,535 m²
Dijual BU Rumah City Resort Cluster Malibu,"Cengkareng Timur, Jakarta Barat",Rp1.880.000.000,5,130 m²,90 m²
"Dijual Cepat Rumah Tinggal di Cluster Semayang, ASYA, JGC, Cakung, Jakarta Timur","Cakung, Jakarta Timur",Rp2.750.000.000,3,115 m²,98 m²
Dijual Tempat Usaha LT 288 m2 Strategis Salembaba Jakarta Pusat,"Senen, Jakarta Pusat",Rp13.900.000.000,5,200 m²,288 m²
chandra Rumah uk 8x20m di grogol,"Grogol, Jakarta Barat",Rp3.950.000.000,3,300 m²,160 m²
Jual cepat rumah di cluster yarra JGC Jakarta Garden City,"Cakung Timur, Jakarta Timur",Rp1.600.000.000,5,50 m²,90 m²
Rumah  minimalis modern di jalan pemuda Rawamangun Jakarta timur,"Rawamangun, Jakarta Timur",Rp1.329.300.000,3,67 m²,48 m²
"Jual Rumah Cluster Alamanda Sudah Renov, JGC Jakarta Timur","Cakung, Jakarta Timur",Rp4.500.000.000,3,156 m²,278 m²
Dijual Rumah siap Huni di Tanjung Barat Jakarta Selatan,"Tanjung Barat, Jakarta Selatan",Rp15.000.000.000,4,264 m²,369 m²
Dijual Rumah Pik2 uk 6x12.5 Semi Furnish Termurah,Jakarta Utara,Rp2.400.000.000,3,90 m²,75 m²
"Jual Murah Cepat Rumah di Taman Modern cakung, 220 m² jalan utama","Ujung Menteng, Jakarta Timur",Rp2.800.000.000,6,200 m²,220 m²
"Dijual Rumah di Cendrawasih, Cengkareng Barat , Jakarta Barat.","Cengkareng Barat, Jakarta Barat",Rp860.000.000,2,72 m²,48 m²
Rumah Mewah Luas Full Furnished di Legenda Wisata dekat Tol,"Legenda Wisata, Jakarta Timur",Rp2.350.000.000,4,140 m²,180 m²
Dijual Rumah Di Tanjung Duren Jakarta Barat,"Tanjung Duren, Jakarta Barat",Rp1.300.000.000,3,60 m²,37 m²
Dijual Rumah di Pondok Kelepa Baru 2 Lantai 3 KT 2 KM,Jakarta Timur,Rp1.661.440.000,3,77 m²,68 m²
Dijual Rumah di Terusan Casablanca Jakarta - Timur,"Pondok Bambu, Jakarta Timur",Rp3.800.000.000,4,200 m²,119 m²
Dijual Rumah Murah 2 lantai tanpa DP di Kalideres Jakarta Barat,"Kalideres, Jakarta Barat",Rp1.765.000.000,3,70 m²,68 m²
Utan Kayu House Jakarta Timur,"Utan Kayu, Jakarta Timur",Rp2.400.000.000,6,200 m²,79 m²
Rumah 3 lantai Retro Asia Modern Eonna BSD Gading Serpong,"Puri Indah, Jakarta Barat",Rp5.657.700.000,5,255 m²,144 m²
"Rumah 1,7 lantai kolam renang anak dekat Tol Jatikarya Bekasi","Ciracas, Jakarta Timur",Rp1.701.000.000,3,131 m²,82 m²
Rumah murah belakang plaza Cibubur Transyogi,"Ciracas, Jakarta Timur",Rp1.059.000.000,2,64 m²,81 m²
Rumah Permata Taman Palem 12x20 Jarang Ada. NEGO SAMPAI DEAL,"Kalideres, Jakarta Barat",Rp5.000.000.000,5,240 m²,180 m²
Dijual Rumah lama Hitung Tanah saja,"Pondok Labu, Jakarta Selatan",Rp7.000.000.000,4,200 m²,585 m²
Dijual Rumah Baru Tanpa DP di Pengasinan Depok,"Ragunan, Jakarta Selatan",Rp560.000.000,2,45 m²,72 m²
"DIJUAL RUMAH AREA SUTERA ELOK, ALAM SUTERA","Menteng Dalam, Jakarta Selatan",Rp3.000.000.000,4,97 m²,128 m²
Dijual Rumah di Pondok Kelapa Promo Bulan Juli,Jakarta Timur,Rp1.581.920.000,3,77 m²,63 m²
Rumah Cluster 2 Lantai Dijual,"Jagakarsa, Jakarta Selatan",Rp1.700.000.000,4,140 m²,81 m²
Rumah Cipete Selatan,"Cipete Selatan, Jakarta Selatan",Rp11.500.000.000,5,400 m²,453 m²
jual cepat rumah legenda wisata cibubur dekat tol kota wisata,"Cibubur, Jakarta Timur",Rp1.300.000.000,3,100 m²,126 m²
Rumah 2 Lantai Dijual di Park Residence Bebas Banjir Siap KPR J-20012,"Kalideres, Jakarta Barat",Rp1.400.000.000,2,80 m²,55 m²
"Expert Project Garden Exclusive-Rumah mewah 3,5 lantai di Jakarta","Cakung, Jakarta Timur",Rp1.967.000.000,3,63 m²,75 m²
Dijual Rumah Mewah Murah Strategis Kolam Renang Di Bintaro Jaksel,Jakarta Selatan,Rp14.000.000.000,5,263 m²,500 m²
Rumah Dijual Brand New Di Jagakarsa Jakarta Selatan,"Jagakarsa, Jakarta Selatan",Rp2.228.000.000,3,170 m²,60 m²
"Rumah Golf island Uk 10x35 Ada lift dan pool View golf, danau, laut","Pantai Indah Kapuk, Jakarta Utara",Rp20.000.000.000,4,350 m²,350 m²
Rumah Cempaka Putih Jakarta Pusat,"Cempaka Putih, Jakarta Pusat",Rp13.500.000.000,5,513 m²,644 m²
"Kamar Master Di Bawah, Halaman Besar, Carport Bisa 10 Mobil","Kebayoran Lama, Jakarta Selatan",Rp15.000.000.000,3,400 m²,1070 m²
RUMAH DIJUAL DI CILANDAK LUAS DAN ASRI BISA NEGO,"Cilandak, Jakarta Selatan",Rp18.000.000.000,9,570 m²,535 m²
Dijual BU Rumah City Resort Cluster Malibu,"Cengkareng Timur, Jakarta Barat",Rp1.880.000.000,5,130 m²,90 m²
Rumah Minimalis dengan Furnished Gading Serpong dan Elektronik Promo,"Kembangan, Jakarta Barat",Rp1.433.000.000,2,68 m²,43 m²
Rumah Mewah Hoek 8x15 Gading Serpong Pasadena Residence,"Kembangan, Jakarta Barat",Rp4.625.540.000,4,142 m²,178 m²
