title,lokasi,harga,kamar_tidur,luas_bangunan_m2,luas_tanah_m2
Rumah Mewah Fully Furnished Cluster Lakewood Navapark BSD,"Sampora, Tangerang",Rp10.700.000.000,5,337 m²,220 m²
Rumah Cluster Cajuputi Boulevard Luas 450 Depark BSD,"Pagedangan, Tangerang",Rp12.000.000.000,4,335 m²,450 m²
Dekat Aeon Mall BSD Rumah Cluster Verdant View Lebar 8 The Icon,"Sampora, Tangerang",Rp2.500.000.000,3,73 m²,128 m²
RUMAH TANGERANG MURAH,"Tigaraksa, Tangerang",Rp375.000.000,2,60 m²,60 m²
Dijual Rumah Bebas Banjir di Duta Garden Siap Huni Bisa KPR J-18232,"Benda, Tangerang",Rp2.550.000.000,4,240 m²,240 m²
Rumah Bebas Banjir di Lavon Swancity Cluster Enchanta Bisa KPR J-13558,"Sindang Jaya, Tangerang",Rp910.000.000,3,79 m²,69 m²
Taman Permata Ayu Karawaci J-19905,"Curug, Tangerang",Rp2.100.000.000,4,220 m²,200 m²
Cluster Surya Aryana karawaci,"Karawaci, Tangerang",Rp735.000.000,3,51 m²,72 m²
Jual Rumah Minimalis di Perumahan Taman Palma Bebas Banjir J-18563,"Cikupa, Tangerang",Rp1.500.000.000,4,216 m²,108 m²
Rumah Furnished Hook Cikupa Panongan Citra Raya Tangerang Banten,"Cikupa, Tangerang",Rp895.000.000,3,90 m²,108 m²
Jual rumah 2 lantai Terravia Adore daerah BSD Gading Serpong,"Tanah Tinggi, Tangerang",Rp1.922.000.000,3,93 m²,66 m²
Rumah Full Furnished Tanpa DP di cluster Tanakayu Vasya BSD Serpong,"Gading Serpong, Tangerang",Rp2.985.000.000,4,137 m²,84 m²
modal hemat siap huni 5 juta all in di sepatan tangerang,"Sepatan, Tangerang",Rp673.875.000,2,52 m²,105 m²
"rumah siap huni,,,anti BANJIR",Tangerang,Rp175.000.000,2,36 m²,60 m²
"New Cluster Excelia, Excellent Living in Banjar Wijaya","Cipondoh, Tangerang",Rp1.288.657.125,3,64 m²,50 m²
S629.Rumah 2Lt cukup Booking 5jt Free Biaya Langsung akad di Larangan,"Larangan, Tangerang",Rp988.413.098,2,64 m²,48 m²
Rumah Murah siap huni Furnish di Karawaci Summarecon akses strategis,"Karawaci, Tangerang",Rp800.000.000,2,36 m²,72 m²
Dijual Rumah SHM 3KT 5 Menit Stasiun Cisauk dan Aeon BSD Bisa KPR nego,"Cisauk, Tangerang",Rp970.000.000,3,54 m²,60 m²
dijual rumah bundaran depan citra Raya cikupa tangerang,"Cikupa, Tangerang",Rp835.000.000,3,96 m²,96 m²
"Dijual Rumah 2 lantai di Cluster Alicante, Gading Serpong, Tang Sel","Gading Serpong, Tangerang",Rp2.800.000.000,4,132 m²,144 m²
"Dijual Rumah di PHG, Cluster Ruby, Gading Serpong, Tangerang","Gading Serpong, Tangerang",Rp3.000.000.000,4,200 m²,144 m²
Rumah Mewah 2 Lantai Semi Furnish di Tangerang Gading Serpong,"Gading Serpong, Tangerang",Rp6.345.100.000,4,208 m²,162 m²
Rumah Mewah Matera Residences Gading Serpong,"Gading Serpong, Tangerang",Rp6.200.000.000,5,208 m²,162 m²
Investasi Properti Terbaik: Dapatkan Rumah Cantik di Lingkungan Ramah,Tangerang,Rp450.000.000,2,36 m²,60 m²
Rumah Nyaman Strategis Taman Royal 2 Cipondoh,"Cipondoh, Tangerang",Rp2.200.000.000,4,250 m²,180 m²
rumah 2 lantai ready stok. cukup DP 0%. langsung auto approve,"Cikupa, Tangerang",Rp1.200.000.000,4,96 m²,77 m²
dijual rumah Serpong Garden 2 Cisauk,"Cisauk, Tangerang",Rp925.000.000,2,45 m²,84 m²
Rumah cluster di perbatasan jakarta tangsel,"Kedaung Wetan, Tangerang",Rp700.000.000,3,78 m²,56 m²
Rumah Di Jual 2 Lantai Bebas Banjir Di Ciputat Timur Tangerang Selatan,"Cempaka Putih, Tangerang",Rp1.617.000.000,3,78 m²,60 m²
Dijual Cepat Rumah Cluster Chalcedony PHG - Gading serpong,"Gading Serpong, Tangerang",Rp6.250.000.000,5,300 m²,261 m²
Rumah Impian Pasadena Grand Residences,"Pagedangan, Tangerang",Rp7.642.400.000,5,284 m²,250 m²
"Ready Stock Rumah 2 Lantai, Aman & Nyaman. Stasiun Parung Panjang.","Legok, Tangerang",Rp591.519.000,1,53 m²,72 m²
"Ready Stock Rumah 2 Lantai, Posisi Pintu Masuk. Legok, Serpong.","Legok, Tangerang",Rp753.135.000,2,62 m²,92 m²
Rumah dijual dekat Halte Busway Adam Malik Ciledug,"Ciledug, Tangerang",Rp1.750.000.000,3,96 m²,106 m²
Rumah dijual dekat Halte Busway Adam Malik Ciledug,"Ciledug, Tangerang",Rp1.750.000.000,3,96 m²,106 m²
Rumah di Jual Ready Di Bintaro Dekat BXC 2 LT 4 KT Free Biaya SHM4,"Pondok Ranji, Tangerang",Rp2.200.000.000,4,90 m²,190 m²
Dijual Rumah Mewah Harga Murah 3 Lantai Siap Huni di Taman Puspa,"Cikupa, Tangerang",Rp2.700.000.000,6,560 m²,239 m²
RUMAH READY STOK TELAGA LEGOK,"Legok, Tangerang",Rp300.000.000,3,45 m²,72 m²
Rumah Bagus 2 Lantai di Graha Raya Bintaro,"Pondok Aren, Tangerang",Rp1.700.000.000,5,192 m²,105 m²
Rumah Modern Pasadena Grand Residences,"Pagedangan, Tangerang",Rp7.556.000.000,5,316 m²,240 m²
Dijual rumah huni di kawasan startegis karawaci tangerang,"Karawaci, Tangerang",Rp4.700.000.000,6,319 m²,339 m²
Jual Rumah 2 lantai dalam cluster di kawasan serpong,"Pagedangan, Tangerang",Rp1.150.000.000,2,53 m²,40 m²
Rumah Dijual di Perum Cluster Agung Indah Bebas Banjir J-16173,"Curug, Tangerang",Rp540.000.000,2,36 m²,72 m²
Posisi Paling Depan Rumah Ready Cluster Caelus Greenwich Park BSD,"Pagedangan, Tangerang",Rp8.554.842.000,4,248 m²,220 m²
Excelia Banjar Wijaya Rumah Tanpa DP Cicilan 8 Jutaan,"Cipondoh, Tangerang",Rp1.252.737.500,3,64 m²,50 m²
Rumah Siap Huni di Karawaci Sudah Renovasi SHM Hook 3KT 2LT,"Karawaci, Tangerang",Rp2.600.000.000,4,200 m²,168 m²
jual rugi aja rumah lavon city,"Pasar Kemis, Tangerang",Rp1.500.000.000,4,120 m²,126 m²
Rumah Bagus 2 Lantai di Pusat Garment Tangerang,"Cipadu, Tangerang",Rp1.350.000.000,3,100 m²,75 m²
JUAL RUMAH BARU PASADENA GADING SERPONG,"Gading Serpong, Tangerang",Rp4.500.000.000,5,174 m²,144 m²
dijual cepat rumah lokasi sukabakti harga nego bisa kpr,"Curug, Tangerang",Rp810.000.000,2,50 m²,72 m²
Rumah SUPER MEVVAH di Lokasi SUPER DUPER STRATEGIS di Barat Jakarta,"Cipadu, Tangerang",Rp1.597.000.000,3,100 m²,88 m²
Rumah 2 Lantai Siap Huni dekat Pasar Modern BSD City Siap KPR J-20435,"Gading Serpong, Tangerang",Rp2.250.000.000,4,150 m²,98 m²
The Eminent Cluster Precia J-17480,"Pagedangan, Tangerang",Rp3.600.000.000,3,171 m²,135 m²
Lippo Karawaci J-19702,"Curug, Tangerang",Rp2.250.000.000,3,150 m²,120 m²
Jual Rumah Harga Nego di Bintaro Full Furnished Bisa KPR J-15976,"Pondok Aren, Tangerang",Rp1.690.000.000,2,80 m²,98 m²
DIJUAL RUMAH MEWAH DESIGN VILLA SEMI FURNISHED di DELATINOS BSD,"Gading Serpong, Tangerang",Rp5.650.000.000,5,360 m²,225 m²
3 Kamar Tidur Tipe Sakura Springhill Yume Lagoon,"Cisauk, Tangerang",Rp1.000.000.000,3,71 m²,72 m²
jual rumah cluster Abira suvarna padma,"Cikupa, Tangerang",Rp750.000.000,2,45 m²,102 m²
Welton Signature Hiera BSD City New Fasad,"Kadusirung, Tangerang",Rp3.660.000.000,4,166 m²,128 m²
Rumah di The Eminent Cluster Precia dekat  The Breeze BSD City J-20906,"Pagedangan, Tangerang",Rp2.500.000.000,3,102 m²,96 m²
Rumah Strategis Siap Huni di Bintaro Sektor 3 Harga Nego Siap KPR J-21225,"Pondok Aren, Tangerang",Rp3.000.000.000,3,133 m²,229 m²
Rumah di The Icon BSD Cluster Eternity 10 menit ke BSD Plaza J-20996,"Cisauk, Tangerang",Rp3.100.000.000,3,150 m²,162 m²
RUMAH SIAP HUNI DI GADING SERPONG,"Gading Serpong, Tangerang",Rp1.850.000.000,4,120 m²,90 m²
Rumah 2 Lantai Park Serpong Cendana Livin Dekat Tol Lippo Karawaci,"Kelapa Dua, Tangerang",Rp750.000.000,3,68 m²,82 m²
Rumah di Citra Raya Tangerang dekat Pasar Desa Cikupa Siap KPR J-21273,"Panongan, Tangerang",Rp890.000.000,2,64 m²,96 m²
Rumah Minimalis Dekat Tol Balaraja Timur Strategis Harga Nego J-14680,"Balaraja, Tangerang",Rp650.000.000,2,27 m²,60 m²
DIJUAL RUMAH  HOMEY  1 LT DI PINGGIR JLN PONDOK JAYA BINTARO SEKTOR 7,"Pondok Aren, Tangerang",Rp4.000.000.000,5,299 m²,297 m²
Rumah Klaster Chiara Murah Suvarna Cikupa Tangerang,"Cikupa, Tangerang",Rp1.850.000.000,4,142 m²,180 m²
Rumah uk 8x20 di Metro Permata 1,"Cipondoh, Tangerang",Rp2.750.000.000,5,240 m²,160 m²
Rumah Tipe 2 BR Harga Promo Free PPN Springhill Yume Lagoo n,"Suradita, Tangerang",Rp700.000.000,2,36 m²,60 m²
Rumah cantik minimalis modern di jurangmangu barat,"Jurang Mangu Barat, Tangerang",Rp1.200.000.000,3,110 m²,79 m²
Rumah 3 Lantai Dengan Attic Room Dekat Aeon Mall BSD,"Cisauk, Tangerang",Rp2.700.000.000,4,141 m²,120 m²
Rumah Modern Tropical Resort 3 Lantai Di BSD City,"Benda, Tangerang",Rp3.000.000.000,3,137 m²,84 m²
Rumah 2 Lantai Fasilitas Lengkap Di Sekitar Serpong,"Cisauk, Tangerang",Rp1.500.000.000,3,85 m²,90 m²
Dijual Rumah di Komplek Deplu Adam Malik Ciledug,"Ciledug, Tangerang",Rp3.950.000.000,5,430 m²,530 m²
Dijual Rumah Murah Cassia Ayodhya Tangerang,"Cikokol, Tangerang",Rp1.890.000.000,3,85 m²,84 m²
Rumah Idaman 2 Lantai Harga Ramah Di Kawasan BSD,"Cisauk, Tangerang",Rp1.900.000.000,3,95 m²,105 m²
Rumah Gajah Harga Semut Springhill Yume Lagoon,"Cisauk, Tangerang",Rp1.800.000.000,4,104 m²,112 m²
HOT SALE Rumah Area Graha Raya Cluster Melia Grove - 0074,"Paku Jaya, Tangerang",Rp2.300.000.000,4,120 m²,135 m²
RUMAH MURAH MERIAH,"Daru, Tangerang",Rp115.000.000,2,36 m²,60 m²
Rumah Kost Alloggio Siap Huni di Gading Serpong,"Gading Serpong, Tangerang",Rp2.164.500.000,10,139 m²,70 m²
J-16101 Rumah Siap Huni Full Renov Di Metro Serpong 1 Stasiun Cisauk,"Cisauk, Tangerang",Rp490.000.000,2,60 m²,60 m²
DIJUAL RUMAH CANTIK MODERN CLASSIC DI GADING SERPONG CLUSTER MELROSE,"Gading Serpong, Tangerang",Rp1.700.000.000,3,68 m²,55 m²
Dijual/Lelang Rumah Murah Di Ciledug,"Ciledug, Tangerang",Rp800.000.000,3,120 m²,160 m²
Rumah Millenial 3 Lantai Konsep Jepang - The Villa Daisan Swancity,"Cikupa, Tangerang",Rp900.000.000,3,73 m²,40 m²
"DIJUAL CEPAT, RUMAH THE GREEN RESIDENCE LEGOK (CLUSTER)","Legok, Tangerang",Rp990.000.000,2,70 m²,78 m²
"Jual rumah di bawah PPJB, Cluster Atlanta Village, Paramount Serpong","Gading Serpong, Tangerang",Rp2.000.000.000,4,131 m²,80 m²
DIJUAL RUMAH 2 LANTAI TERMEWAH DI TIGARAKSA CICILAN 3 JUTAAN,"Tigaraksa, Tangerang",Rp573.800.000,3,57 m²,60 m²
"DIJUAL SEGERA RUMAH 1,5 Lt.","Poris Plawad Indah, Tangerang",Rp1.000.000.000,2,80 m²,60 m²
Dijual Rumah Citra Raya 2L strategis kemana2,"Cikupa, Tangerang",Rp1.000.000.000,4,125 m²,100 m²
Rumah Strategis Dijual di Kencana Loka Dekat Stasiun Siap Nego J-20120,"Gading Serpong, Tangerang",Rp3.530.000.000,6,148 m²,200 m²
DI JUAL RUMAH GARDEN GROOVE CITRA RAYA TANGERANG,Tangerang,Rp650.000.000,2,45 m²,80 m²
"Rumah Dalton, Gading Serpong, dijual murah, rapi, siap huni",Tangerang,Rp2.900.000.000,5,200 m²,126 m²
Rumah Baru dalam perumahan,"Cipadu, Tangerang",Rp800.000.000,2,45 m²,90 m²
Rumah Super Luas Posisi Hoek dijual di Lippo Karawaci,"Karawaci, Tangerang",Rp2.600.000.000,4,168 m²,200 m²
Rumah cluster dekat Dengan stasiun Pdk Ranji,"Pondok Ranji, Tangerang",Rp1.700.000.000,3,90 m²,72 m²
Rumah Fully Furnished 1M-an Zuma Malibu Gading Serpong,"Gading Serpong, Tangerang",Rp1.400.000.000,2,63 m²,48 m²
Rumah Moderen Minimalis Siap Huni Adam Malik Deplu,"Kreo Selatan, Tangerang",Rp1.850.000.000,4,110 m²,84 m²
tanahnya luas cuma bayar 5 juta all in,"Sepatan, Tangerang",Rp835.875.000,2,52 m²,141 m²
Rumah Mewah Bergengsi Matera Residences Gading Serpong,"Gading Serpong, Tangerang",Rp6.250.000.000,5,208 m²,162 m²
Rumah Murah Furnish di Lippo Karawaci dekat Summarecon Serpong dan Tol,"Karawaci, Tangerang",Rp800.000.000,2,36 m²,72 m²
"Townhouse Syariah di kawasan strategis BSD, Serpong","Gading Serpong, Tangerang",Rp1.900.000.000,3,60 m²,60 m²
Dijual rumah murah dekat mall citra Raya cikupa tangerang,"Cikupa, Tangerang",Rp375.000.000,2,60 m²,60 m²
"Rumah Berkualitas Tinggi, Harga Terjangkau - Segera Miliki",Tangerang,Rp380.000.000,1,28 m²,28 m²
Rumah Komplek Deplu 2 Lantai + Rooftop Dekat Tol Tangerang Free Biaya,"Cipadu, Tangerang",Rp1.597.000.000,3,100 m²,63 m²
Rumah dengan SHM di Cluster Paradiso Residence Tangerang KPR J-11542,"Tangerang, Tangerang",Rp561.750.000,2,45 m²,66 m²
DI JUAL RUMAH ASRI SIAP HUNI DI KARANG TENGAH TANGERANG,"Karang Tengah, Tangerang",Rp1.495.000.000,3,113 m²,72 m²
MILIKI RUMAH BARU DI PERMATA DARU,"Daru, Tangerang",Rp305.571.400,2,33 m²,72 m²
dijual rumah besar mewah luas 2 lantai di cisauk,"Cisauk, Tangerang",Rp1.980.000.000,4,114 m²,102 m²
Rumah Semi Furnish  2 Lantai di Alam Sutera Kota Tangerang,"Tangerang, Tangerang",Rp2.695.000.000,4,138 m²,112 m²
Rumah minimalis murah KPR Tanpa DP Terravia Adore BSD Gading Serpong,"Tangerang, Tangerang",Rp1.923.000.000,3,93 m²,66 m²
"Rumah 2 lantai dijual di Citra Raya, Tangerang","Cikupa, Tangerang",Rp975.000.000,3,140 m²,90 m²
FOR SALE - Rumah Smarthome Double Decker Lavon 2 Viridia - Lucky 7,"Cikupa, Tangerang",Rp1.350.000.000,4,124 m²,54 m²
Welton Signature Hiera BSD City New Fasad,"Kadusirung, Tangerang",Rp3.660.000.000,4,166 m²,128 m²
Rumah bernilai tinggi dekat dengan fasilitas utama BSD di Alesha House,"Pagedangan, Tangerang",Rp1.536.416.000,3,90 m²,33 m²
"Hunian untuk kaum milenial dengan Kolam renang Pribadi, di Vanya Park, BSD City","Pagedangan, Tangerang",Rp1.426.315.000,3,33 m²,90 m²
Rumah Mewah free furnished 700 JT,"Cikokol, Tangerang",Rp3.200.000.000,5,194 m²,112 m²
"Di Jual Rumah Siap Huni di JadePark 1, BSD City - Tangerang","Buaran, Tangerang",Rp1.400.000.000,3,78 m²,91 m²
S627.Cluster Clasic Modern 2 Lt Ready Stock Nempel Bintaro Free biaya,"Pondok Aren, Tangerang",Rp1.418.500.000,3,90 m²,60 m²
Dijual rumah baru citra raya cikupa tangerang,"Cikupa, Tangerang",Rp500.000.000,3,72 m²,72 m²
Cluster Adora. BSD City,"Gading Serpong, Tangerang",Rp2.700.000.000,5,144 m²,84 m²
HOT SALE Rumah Apik dijual Furnished 1 Lantai di Pondok Aren TK-12210,"Pondok Aren, Tangerang",Rp1.000.000.000,2,53 m²,107 m²
Jual Cluster Strategis Dekat Kawasan BSD,"Cisauk, Tangerang",Rp728.750.000,2,50 m²,84 m²
Dijual rumah hook bundaran 3 Citra Raya cikupa tangerang,"Cikupa, Tangerang",Rp1.200.000.000,3,164 m²,158 m²
Rumah Hook full furnish Granada Gading serpong,"Gading Serpong, Tangerang",Rp5.739.900.000,4,178 m²,196 m²
Rumah 2 ltTerbaik & Terlaris di Tangerang Utara dekat Jakarta Barat,"Pasar Kemis, Tangerang",Rp588.000.000,2,58 m²,60 m²
RUMAH CLUSTER PELICAN 1 LT DI GRAND BATAVIA TANGERANG,"Periuk Jaya, Tangerang",Rp412.693.127,2,,
Dijual rumah scandinavian cluster BSD Tangerang Selatan,"Pagedangan, Tangerang",Rp850.000.000,3,70 m²,60 m²
"Rumah baru free biaya surat²,lokasi dekat tol bsd dan stasiun","Ciater, Tangerang",Rp1.000.000.000,3,80 m²,60 m²
RUMAH 2 LANTAI CLUSTER PELICAN HARGA 600 JUTAAN,"Pasar Kemis, Tangerang",Rp614.232.653,2,,
"Rumah 1 Lantai, Mewah dengan Fasilitas Lengkap di Legok Serpong","Legok, Tangerang",Rp904.039.987,3,47 m²,84 m²
RUMAH MURAH READY DEKAT CURUG BITUNG,"Curug, Tangerang",Rp392.500.000,2,36 m²,60 m²
dijual Rumah mewah dan murah dicirendeu,"Cireundeu, Tangerang",Rp5.400.000.000,5,369 m²,274 m²
RUMAH UNIK 2 LANTAI DI CIKUPA TANGERANG,"Cikupa, Tangerang",Rp915.000.000,3,92 m²,55 m²
HUNIAN KEREN TERLARIS DI TANGERANG,"Pasar Baru, Tangerang",Rp699.400.000,3,,
Rumah 2 lantai dekat bandara soetta,Tangerang,Rp565.200.000,2,45 m²,50 m²
rumah termewah luxury di gading serpong,"Gading Serpong, Tangerang",Rp6.345.100.000,4,208 m²,162 m²
JUAL CLUSTER TANAKAYU TYPE 6,Tangerang,Rp1.100.000.000,3,66 m²,86 m²
Dijual Rumah Greenlake City Cluster Amerika Latin Hadap Danau (DW),"Kosambi, Tangerang",Rp4.800.000.000,5,210 m²,180 m²
JUAL CLUSTER TANAKAYU TYPE 5,Tangerang,Rp900.000.000,2,50 m²,70 m²
Rumah baru di pusat Kota Tangerang mulai dr dibawah 1 Man,"Cimone, Tangerang",Rp1.097.000.000,3,65 m²,60 m²
"DP MURAH CICILAN RINGAN, BUMI INDAH CITY PASAR KEMIS","Pasar Kemis, Tangerang",Rp583.000.000,2,36 m²,78 m²
dijual rumah siap huni lokasi 5 menit dari stasiun cisauk harga nego,"Cisauk, Tangerang",Rp750.000.000,2,45 m²,84 m²
Rumah Millenial 3 Lantai di Tangerang - the Flexible Daisan Swancity,"Cikupa, Tangerang",Rp1.200.000.000,4,97 m²,50 m²
TERMURAH Rumah Hook MOZART Symphonia Gading Serpong Tepi Danau,"Gading Serpong, Tangerang",Rp9.000.000.000,4,269 m²,289 m²
Rumah Siap Huni Rapih Cikupa Panongan Citra Raya Tangerang Banten,"Cikupa, Tangerang",Rp630.000.000,2,92 m²,92 m²
Jual rumah strategis dekat bandara & pik-2,Tangerang,Rp585.000.000,2,38 m²,72 m²
Harus terjual Rumah murah di cipondoh strategis,Tangerang,Rp980.000.000,4,99 m²,124 m²
Jual Cepat Rumah Brand New Cluster Impresahaus BSD City,"Pagedangan, Tangerang",Rp1.800.000.000,3,88 m²,60 m²
Jual Cepat Rumah Cantik Cluster Vivaldi Symponia Gading Serpong,"Gading Serpong, Tangerang",Rp4.700.000.000,3,170 m²,144 m²
Beverly Golf Lippo Karawaci,"Karawaci, Tangerang",Rp19.000.000.000,6,800 m²,625 m²
Rumah Mewah Cluster Lakewood Lebar 12 Navapark BSD,"Sampora, Tangerang",Rp15.500.000.000,5,500 m²,336 m²
Rumah Dua Lantai Mewah dengan Desain Modern,"Cisauk, Tangerang",Rp1.641.440.000,4,104 m²,112 m²
"rumah di gading serpong, clstr naara village - paramount, good deal","Gading Serpong, Tangerang",Rp3.550.000.000,3,116 m²,120 m²
"Dijual Rumah Asri Ada Taman Depan Dan Belakang Di Bintaro, Tangsel.","Pondok Aren, Tangerang",Rp3.880.000.000,3,200 m²,313 m²
"Dijual Rumah 2 Lantai di Ciledug, Bebas Banjir","Ciledug, Tangerang",Rp2.500.000.000,4,140 m²,222 m²
Dijual rumah murah 2 lantai melia Graha Raya,Tangerang,Rp2.150.000.000,4,110 m²,135 m²
jual cepat rumah gading serpong,"Gading Serpong, Tangerang",Rp2.700.000.000,3,160 m²,126 m²
Di Jual Rumah Nyaman Duta Bintaro Dekat Tol Alam Sutera,"Pinang, Tangerang",Rp885.000.000,2,72 m²,97 m²
Rumah Dijual di Panunggangan Utara 8 Menit ke Tol Tangerang 2 J-11962,"Pinang, Tangerang",Rp2.140.000.000,6,185 m²,200 m²
rumah murah 2 lantai tanpa dp,Tangerang,Rp773.125.000,4,65 m²,70 m²
Rumah Siap Huni 2 Lantai di Komplek Holandia Karawaci,"Karawaci, Tangerang",Rp2.200.000.000,4,146 m²,120 m²
Rumah Siap Huni Bagus Rapi di Cluster Ubud 1 Duta Bintaro-Tangerang,"Kunciran, Tangerang",Rp830.000.000,3,90 m²,60 m²
DIJUAL RUMAH 2 LANTAI TERMEWAH DI TIGARAKSA CICILAN 3 JUTAAN,"Tigaraksa, Tangerang",Rp573.800.000,3,57 m²,60 m²
Rumah Super Luas Posisi Hoek dijual di Lippo Karawaci,"Karawaci, Tangerang",Rp2.600.000.000,4,168 m²,200 m²
Rumah Baru dalam perumahan,"Cipadu, Tangerang",Rp800.000.000,2,45 m²,90 m²
Rumah cluster dekat Dengan stasiun Pdk Ranji,"Pondok Ranji, Tangerang",Rp1.700.000.000,3,90 m²,72 m²
Rumah Fully Furnished 1M-an Zuma Malibu Gading Serpong,"Gading Serpong, Tangerang",Rp1.400.000.000,2,63 m²,48 m²
Rumah Dijual Dekat Gerbang Tol Karawaci 2 Siap KPR Bisa Nego J-19471,"Curug, Tangerang",Rp2.680.000.000,4,200 m²,160 m²
"DIJUAL SEGERA RUMAH 1,5 Lt.","Poris Plawad Indah, Tangerang",Rp1.000.000.000,2,80 m²,60 m²
Rumah Hook full furnish Granada Gading serpong,"Gading Serpong, Tangerang",Rp5.739.900.000,4,178 m²,196 m²
"Cluster Fortune Spring, Graha Raya Bintaro Jaya","Ciledug, Tangerang",Rp2.500.000.000,4,72 m²,150 m²
Jual Cluster Strategis Dekat Kawasan BSD,"Cisauk, Tangerang",Rp728.750.000,2,50 m²,84 m²
Dijual rumah hook bundaran 3 Citra Raya cikupa tangerang,"Cikupa, Tangerang",Rp1.200.000.000,3,164 m²,158 m²
RUMAH 2 LANTAI LEGOK,"Legok, Tangerang",Rp1.500.000.000,3,48 m²,69 m²
Rumah Tipe Yuri Springhill Yuma Lagoon  Bisa  KPR,"Cisauk, Tangerang",Rp500.000.000,1,30 m²,50 m²
Rumah 1 Lantai Cocok Untuk Keluarga Baru Di Tangerang,"Legok, Tangerang",Rp1.000.000.000,3,70 m²,120 m²
DIJUAL RUMAH BARU VIEW DANAU CLUSTER MOZART GADING SERPONG,"Gading Serpong, Tangerang",Rp12.500.000.000,4,286 m²,276 m²
Rumah Cantik dan Minimalis di Premier Park 2 Tangerang Banten Tangerang,"Cikokol, Tangerang",Rp2.700.000.000,4,150 m²,135 m²
J-19672 Rumah Luas Siap Huni Dekat Dengan Lippo Karawaci Diabntu Kpr,"Cipondoh, Tangerang",Rp780.000.000,2,45 m²,55 m²
Rumah Cantik dan Siap Huni di Cluster Newton Barat Gading Serpong,"Gading Serpong, Tangerang",Rp3.000.000.000,4,213 m²,144 m²
Rumah di tangerang,"Pasar Kemis, Tangerang",Rp480.000.000,2,31 m²,60 m²
Jual Rumah Mewah Cluster Aristoteles Gading Serpong,"Pagedangan, Tangerang",Rp12.000.000.000,5,770 m²,300 m²
Rumah tanah luas disepatan grandcity extention bayar 5 juta akad,"Tangerang, Tangerang",Rp673.450.000,2,52 m²,105 m²
RUMAH BAGUS DIJUAL CEPAT FORTUNE GRAHA RAYA BINTARO TANGERANG,"Pondok Aren, Tangerang",Rp1.300.000.000,2,58 m²,60 m²
Hunian Berkelas Bebas Banjir di Pasadena Grand Residences,"Gading Serpong, Tangerang",Rp6.027.000.000,4,176 m²,228 m²
"Matera Residences, Private Exclusive Living Premium in Gading Serpong","Gading Serpong, Tangerang",Rp6.345.100.000,4,208 m²,162 m²
Rumah Dijual Cluster Mewah Lokasi Strategis Dp 25 Jt All In,"Sudimara Selatan, Tangerang",Rp1.660.000.000,2,88 m²,90 m²
Rumah 2 Lantai di Tangerang Dekat Binus Alsut Strategis J-9916,"Pinang, Tangerang",Rp1.188.500.000,6,170 m²,91 m²
"Rumah Di Starling - 4BR+1 (162 m²) 3.5m, Gading Serpong, Tangerang","Gading Serpong, Tangerang",Rp3.500.000.000,4,162 m²,162 m²
Rumah mewah 12x25 Matera Residences Gading Serpong BSD,"Gading Serpong, Tangerang",Rp12.990.000.000,5,432 m²,250 m²
Rumah Asri dan nyaman,"Pondok Betung, Tangerang",Rp1.300.000.000,3,140 m²,180 m²
Rumah lokasi depan jalanraya semenit ke pintu tol dekat Lippo Karawaci,Tangerang,Rp500.000.000,2,33 m²,85 m²
"GOLDEN VISTA GNA Grup,booking fee 5jt,dp 0% cicilan 2jt","Curug, Tangerang",Rp299.000.000,1,22 m²,50 m²
ASRI ARYANA KARAWACI,"Curug, Tangerang",Rp735.000.000,3,50 m²,70 m²
DIJUAL RUMAH LUAS DAN NYAMAN DARWIN GADING SERPONG,Tangerang,Rp2.600.000.000,3,170 m²,126 m²
Rumah Siap Huni Bagus Rapi di Cluster Ubud 1 Duta Bintaro-Tangerang,"Kunciran, Tangerang",Rp830.000.000,3,90 m²,60 m²
"rumah di gading serpong, clstr naara village - paramount, good deal","Gading Serpong, Tangerang",Rp3.550.000.000,3,116 m²,120 m²
"Dijual Rumah Asri Ada Taman Depan Dan Belakang Di Bintaro, Tangsel.","Pondok Aren, Tangerang",Rp3.880.000.000,3,200 m²,313 m²
"Dijual Rumah 2 Lantai di Ciledug, Bebas Banjir","Ciledug, Tangerang",Rp2.500.000.000,4,140 m²,222 m²
Rumah Dua Lantai Mewah dengan Desain Modern,"Cisauk, Tangerang",Rp1.641.440.000,4,104 m²,112 m²
Rumah Siap Huni 2 Lantai di Komplek Holandia Karawaci,"Karawaci, Tangerang",Rp2.200.000.000,4,146 m²,120 m²
"Turun Lagi, Harga Rumah (BU) di Parahyangan area Lippo Karawaci","Karawaci, Tangerang",Rp1.250.000.000,5,150 m²,90 m²
Rumah Mewah Cluster Lakewood Lebar 12 Navapark BSD,"Sampora, Tangerang",Rp15.500.000.000,5,500 m²,336 m²
"Jual Rumah Siap Huni di Lokasi Strategis Poris Plawad, Tangerang","Cipondoh, Tangerang",Rp1.000.000.000,2,45 m²,102 m²
Jual murah rumah Faraday L8 Master di Gading serpong,Tangerang,Rp2.400.000.000,4,127 m²,120 m²
Rumah SHM Tinggal Huni Dekat Aeon BSD dan Stasiun Bisa Nego Bisa KPR,"Cisauk, Tangerang",Rp1.140.000.000,2,60 m²,84 m²
Dijual Rumah Eksklusif Di Modernland Tangerang,Tangerang,Rp29.500.000.000,8,2700 m²,2100 m²
"DIJUAL RUMAH DI GRIYA SERPONG ASRI, CISAUK","Cisauk, Tangerang",Rp450.000.000,2,50 m²,72 m²
"Cluster Canna, Rumah Murah Sangat Strategis di Curug","Curug, Tangerang",Rp1.364.000.000,3,68 m²,96 m²
Rumah Fenomenal Diminati Milenial,"Daru, Tangerang",Rp355.000.000,2,36 m²,72 m²
Rumah Premium New Karelia Gading Serpong,"Pagedangan, Tangerang",Rp2.000.000.000,3,78 m²,110 m²
Rumah 2 lantai new samara gading serpong,"Cihuni, Tangerang",Rp1.781.000.000,3,79 m²,63 m²
Dijual Lelang TURUN HARGA Rumah di Ciledug Tangerang,"Parung Serab, Tangerang",Rp2.050.000.000,4,295 m²,165 m²
Dijual BU Rumah Siap Huni Azalea Gading Serpong,"Gading Serpong, Tangerang",Rp2.300.000.000,4,168 m²,119 m²
Rumah Secondary Terawat Siap Huni Cirendeu Tangerang Selatan,"Cireundeu, Tangerang",Rp1.600.000.000,4,160 m²,104 m²
Rumah Murah Cicilan 2Jtan Tangerang dekat dan Mall Ciputra,"Cikupa, Tangerang",Rp630.000.000,2,40 m²,72 m²
S570.Rumah Cluster 2 lantai Lokasi Strategis Harga Ekonomis Free Biaya,"Pondok Aren, Tangerang",Rp1.025.850.000,4,60 m²,60 m²
Rumah Mewah Baru Gading Serpong Matera Residences,Tangerang,Rp5.000.000.000,45,208 m²,162 m²
Rumah Minimalis New Zuma Free Furnished,"Karawaci, Tangerang",Rp1.400.000.000,2,63 m²,48 m²
Rumah Baru dan Mewah dengan Harga Terbaik Adora Primes BSD City,"Pagedangan, Tangerang",Rp2.700.000.000,5,144 m²,84 m²
Rumah 2 lantai Dasana Indah Kelapa Dua Tangerang,"Karawaci, Tangerang",Rp900.000.000,4,100 m²,60 m²
Rumah Baroni dijual super murah di Gading Serpong,Tangerang,Rp1.375.000.000,3,69 m²,69 m²
Jual Rumah 2 Lantai Strategis dekat Stasiun Tangerang Siap KPR J-20897,"Periuk, Tangerang",Rp910.000.000,2,130 m²,60 m²
Dijual rumah kost 6 pintu lokasi strategis di BSD Gading Serpong,"Gading Serpong, Tangerang",Rp1.677.000.000,6,90 m²,32 m²
Rumah Exclusive Hanya 20 menit ke  Airport dan Exit TOL,"Sepatan, Tangerang",Rp595.000.000,2,38 m²,72 m²
Rumah 1 lantai minimalis tanamera residence free biaya,"Rajeg, Tangerang",Rp297.000.000,2,30 m²,60 m²
"Rumah Minimalis, dekat Stasiun dan Tol di Pondok Aren - TangSel","Pondok Aren, Tangerang",Rp790.000.000,2,45 m²,64 m²
DIJUAL CEPAT RUMAH TINGKAT SIAP HUNI INPRES CILEDUG,"Ciledug, Tangerang",Rp1.250.000.000,4,250 m²,125 m²
Cluster amethys city langsung huni bayar 5juta,"Karawaci, Tangerang",Rp550.000.000,2,30 m²,60 m²
DIJUAL RUMAH DALAM CLUSTER GRAND BATAVIA PASAR KEMIS KAB. TANGERANG,"Pasar Kemis, Tangerang",Rp450.000.000,2,36 m²,60 m²
DIPASARKAN CLUSTER CENDANA ESSENCE TAHAP 2 LOKASI STRATEGIS,"Kelapa Dua, Tangerang",Rp1.100.000.000,3,68 m²,82 m²
Rumah mewah ala resort bali di barat Jakarta dengan 5 kamar tidur,"Karang Tengah, Tangerang",Rp3.300.000.000,5,158 m²,100 m²
Rumah Minimalis New Aster Paramount Petals Curug,"Curug, Tangerang",Rp1.420.200.000,3,59 m²,106 m²
Griya agung residence rumah minimalis dekat jakarta,"Pasar Baru, Tangerang",Rp430.000.000,2,36 m²,72 m²
Bayar 5juta langsung akad sudirman townhouse hunian gaya eropa,"Periuk, Tangerang",Rp689.000.000,3,55 m²,60 m²
"Rumah Dijual di Gading Serpong, Amarillo Village, Full Furnished","Gading Serpong, Tangerang",Rp1.839.100.000,3,67 m²,72 m²
