title,lokasi,harga,kamar_tidur,luas_bangunan_m2,luas_tanah_m2
Dijual Rumah Mewah Posisi Hoek The Icon BSD City,"Bumi Serpong Damai, Tangerang Selatan",Rp5.250.000.000,4,220 m²,202 m²
"Rumah Minimalis Modern 2 Lantai Bintaro Sektor 9, Tanggerang Selatan","Bintaro, Tangerang Selatan",Rp3.950.000.000,4,250 m²,180 m²
Rumah Asri Siap Huni,"Pamulang, Tangerang Selatan",Rp875.000.000,2,60 m²,98 m²
dijual rumah lokasi pamulang harga all in bisa kpr,"Pamulang, Tangerang Selatan",Rp1.470.000.000,3,70 m²,72 m²
"Rumah Minimalis, Megah & Murah di Bintaro Sektor 9, Tanggerang Selatan","Bintaro, Tangerang Selatan",Rp2.400.000.000,2,90 m²,191 m²
Dijual Rumah 2lt Siap Huni Kencana Loka BSD,"Bumi Serpong Damai, Tangerang Selatan",Rp1.575.000.000,3,120 m²,84 m²
Dijual Rumah Renovasi 2lt Delatinos BSD City,"Bumi Serpong Damai, Tangerang Selatan",Rp2.900.000.000,3,180 m²,119 m²
Dijual Murah Rumah 2lt Villa Melati Mas Serpong,"Serpong Utara, Tangerang Selatan",Rp1.750.000.000,5,170 m²,120 m²
Dijual Rumah Mandiri Hoek Ada Pool Delatinos BSD City,"Bumi Serpong Damai, Tangerang Selatan",Rp4.500.000.000,4,300 m²,335 m²
RUMAH BINTARO SEKTOR9 Tangerang MODERN MINIMALIS UNFURNISHED SHM,"Bintaro, Tangerang Selatan",Rp7.500.000.000,4,335 m²,430 m²
Dijual Rumah Hoek 2 Lantai di The Green BSD Cluster Vineyard,"Serpong, Tangerang Selatan",Rp4.850.000.000,4,250 m²,205 m²
"Dijual Rumah Kondisi Baru,Strategis",Tangerang Selatan,Rp2.300.000.000,3,135 m²,90 m²
P. Tanah 120m² Ready Stok Free Biaya2 Sampai SHM At Pamulang Tangsel,"Pamulang, Tangerang Selatan",Rp760.000.000,2,50 m²,120 m²
Rumah di Serpong Paradise 1 lantai dalam Cluster,"Setu, Tangerang Selatan",Rp900.000.000,2,42 m²,60 m²
"Rumah 2 Lantai DP Hanya 5 Juta Free All in Serpon, Tangerang","Serpong, Tangerang Selatan",Rp1.030.500.000,3,58 m²,60 m²
Dijual Rumah Type Minimalist Modern di Pamulang,"Pamulang Barat, Tangerang Selatan",Rp1.100.000.000,3,90 m²,72 m²
DIJUAL RUMAH KPR DP 0% TIPE KIANO BELLEZA GRAHARAYA TANGERANG SELATAN.,"Bintaro, Tangerang Selatan",Rp1.690.000.000,3,68 m²,75 m²
Rumah Baru 2 Lantai Di Pondok Cabe,"Pondok Cabe, Tangerang Selatan",Rp900.000.000,3,78 m²,65 m²
Dijual Rumah di Serua Indah Ciputat SHM 600jtan saja FREE BPHTB & BBN,"Ciputat, Tangerang Selatan",Rp775.000.000,2,45 m²,77 m²
dijual rumah di BSD,"Bumi Serpong Damai, Tangerang Selatan",Rp3.200.000.000,4,131 m²,120 m²
Dijual Rumah Murah di Pamulang,"Pamulang, Tangerang Selatan",Rp680.000.000,2,40 m²,70 m²
"DIJUAL CEPAT RUMAH KOST GRIYA LOKA BSD CITY, AN","Bumi Serpong Damai, Tangerang Selatan",Rp2.400.000.000,6,120 m²,366 m²
Dijual Rumah Bagus Cluster DI Alam Sutera,"Alam Sutera, Tangerang Selatan",Rp5.000.000.000,4,200 m²,140 m²
Rumah Dijual Pamulang Angsuran Murah Mulai 7 Jtan Lengkap Cctv,"Cirendeu, Tangerang Selatan",Rp1.450.000.000,3,45 m²,100 m²
Dijual Rumah Siap Huni di Griya Loka Bsd Free Biaya2 Sampai Balik Nama,"Bumi Serpong Damai, Tangerang Selatan",Rp1.499.000.000,3,62 m²,90 m²
"Rumah Siap Huni 1,5 Lantai Di Bsd","Serpong, Tangerang Selatan",Rp2.600.000.000,4,150 m²,200 m²
Rumah Cantik Nyaman dengan K. Renang dalam Cluster di Legoso Ciputat,"Ciputat, Tangerang Selatan",Rp4.200.000.000,5,195 m²,225 m²
Rumah Skandinavia 2 Lantai Ada Rooftop Bintaro Pondok Aren,"Bintaro, Tangerang Selatan",Rp1.499.000.000,4,104 m²,72 m²
DI JUAL RUMAH MEWAH HOOK DI LYNDON NAVAPARK BSD,"Bumi Serpong Damai, Tangerang Selatan",Rp33.000.000.000,6,545 m²,773 m²
"Dijual Rumah di Giri Loka, BSD City","Serpong Utara, Tangerang Selatan",Rp12.000.000.000,4,500 m²,695 m²
Dijual rumah tinggal dikawasan Tangerang Selatan Pondok Aren,Tangerang Selatan,Rp8.500.000.000,4,250 m²,360 m²
Dijual Cepat Rumah 2 Lantai Berkonsep Bali di Kencana Loka BSD,"Bumi Serpong Damai, Tangerang Selatan",Rp1.850.000.000,3,108 m²,84 m²
Rumah Industrial Modern Selera Milenial Siap Huni Pamulang,"Bambu Apus, Tangerang Selatan",Rp953.000.000,3,65 m²,60 m²
"Rumah Baru Dijual di Griya Loka Sektor 1.6, BSD City","Serpong, Tangerang Selatan",Rp1.975.000.000,3,118 m²,90 m²
DI JUAL RUMAH CLUSTER Provence Park Lane BSD CITY,"Bumi Serpong Damai, Tangerang Selatan",Rp4.740.000.000,5,200 m²,270 m²
Rumah Mewah American Classic Siap Huni Kebayoran Residence Bintaro,"Bintaro, Tangerang Selatan",Rp14.500.000.000,6,300 m²,323 m²
Dijual Rumah 2lt Siap Huni di Discovery Bintaro Jaya Sektor 9,"Bintaro, Tangerang Selatan",Rp2.650.000.000,5,112 m²,105 m²
Rumah di Serpong Paradise 1 lantai dalam Cluster,"Setu, Tangerang Selatan",Rp900.000.000,2,42 m²,60 m²
P. Tanah 120m² Ready Stok Free Biaya2 Sampai SHM At Pamulang Tangsel,"Pamulang, Tangerang Selatan",Rp760.000.000,2,50 m²,120 m²
"Dijual Rumah Kondisi Baru,Strategis",Tangerang Selatan,Rp2.300.000.000,3,135 m²,90 m²
Dijual Rumah Type Minimalist Modern di Pamulang,"Pamulang Barat, Tangerang Selatan",Rp1.100.000.000,3,90 m²,72 m²
"Rumah 2 Lantai DP Hanya 5 Juta Free All in Serpon, Tangerang","Serpong, Tangerang Selatan",Rp1.030.500.000,3,58 m²,60 m²
Rumah Siap Huni Dalam Cluster Bintaro Jaya Sektor 9,"Bintaro, Tangerang Selatan",Rp3.500.000.000,4,202 m²,120 m²
Dijual Rumah   De Park De Naara BSD,"Bumi Serpong Damai, Tangerang Selatan",Rp4.250.000.000,4,200 m²,180 m²
Dijual rumah siap huni 2lt di taman permata Bintaro jaya sektor 9,"Bintaro, Tangerang Selatan",Rp3.600.000.000,5,220 m²,150 m²
Rmh brandnew dg swim pool bangun dr kav di Puri Bintaro Jy Sktr 9,"Bintaro, Tangerang Selatan",Rp5.800.000.000,6,350 m²,194 m²
"Rumah Dijual di The Savia Cluster Visana, BSD City","Serpong, Tangerang Selatan",Rp1.800.000.000,3,87 m²,84 m²
Dijual Rumah siap huni di Sky Mansion full Furniture,"Pamulang, Tangerang Selatan",Rp700.000.000,3,60 m²,55 m²
Dijual Rumah cantik konsep jepang siap huni berlokasi dibsd,"Serpong, Tangerang Selatan",Rp500.000.000,2,30 m²,50 m²
Dijual rumah 2 lantai siap huni lokasi Nusa Loka dekat Pasmod BSD,"Bumi Serpong Damai, Tangerang Selatan",Rp1.450.000.000,2,62 m²,90 m²
"Rumah Minimalis Modern 2 Lantai Bintaro Sektor 9, Tanggerang Selatan","Bintaro, Tangerang Selatan",Rp3.950.000.000,4,250 m²,180 m²
"Rumah Minimalis, Megah & Murah di Bintaro Sektor 9, Tanggerang Selatan","Bintaro, Tangerang Selatan",Rp2.400.000.000,2,90 m²,191 m²
JUAL CPT  TURUN HARGA  Ada Private Pool - Rumah Bintaro Jaya Sektor 7,"Bintaro, Tangerang Selatan",Rp6.500.000.000,5,345 m²,225 m²
Dijual Rumah murah butuh renovasi di Sektor 3 Bintaro Jaya,"Bintaro, Tangerang Selatan",Rp2.700.000.000,4,230 m²,180 m²
Dijual Rumah Mewah Posisi Hoek The Icon BSD City,"Bumi Serpong Damai, Tangerang Selatan",Rp5.250.000.000,4,220 m²,202 m²
Dijual Rumah 2lt Rapi Siap Huni Cluster Foresta BSD City,"Bumi Serpong Damai, Tangerang Selatan",Rp4.150.000.000,3,140 m²,208 m²
Dijual Rumah Strategis Nusaloka BSD City,"Bumi Serpong Damai, Tangerang Selatan",Rp1.080.000.000,2,50 m²,72 m²
Rumah Kebayoran Residence Bintaro - Semi Furnish - NEGO,"Bintaro, Tangerang Selatan",Rp3.900.000.000,4,120 m²,120 m²
TURUN HARGA  JUAL CEPAT  Rumah Kebayoran Residence Bintaro Jaya -NEGO,"Bintaro, Tangerang Selatan",Rp5.300.000.000,5,252 m²,204 m²
dijual rumah lokasi pamulang harga all in bisa kpr,"Pamulang, Tangerang Selatan",Rp1.470.000.000,3,70 m²,72 m²
Rumah Strategis Dekat Pasar Bukit Pamulang Siap KPR Harga Nego J-15479,"Pamulang, Tangerang Selatan",Rp950.000.000,2,80 m²,82 m²
Harga Murah Rumah 2 lantai Di Mandar Bintaro,"Bintaro, Tangerang Selatan",Rp4.500.000.000,4,300 m²,419 m²
Rumah Minimalis 6 Menit ke Mall Paradise Walk Serpong Bisa KPR J-16869,"Setu, Tangerang Selatan",Rp750.000.000,2,60 m²,50 m²
"Di jual rumah bambu apus pamulang, tangerang selatan","Bambu Apus, Tangerang Selatan",Rp2.700.000.000,5,220 m²,267 m²
Dijual rumah mozzia cluster avezza,"Bumi Serpong Damai, Tangerang Selatan",Rp1.850.000.000,2,154 m²,72 m²
Rumah Luas 154 Siap Huni Di  Perumahan Bukit Indah Mk12055,"Ciputat, Tangerang Selatan",Rp1.700.000.000,5,200 m²,154 m²
Rumah Rumah Siap Huni Di Alam Asri Villa Dago Pamulang Mk12061,"Pamulang, Tangerang Selatan",Rp1.750.000.000,5,240 m²,98 m²
Dijual Rumah di Tangerang Selatan,"Ciputat, Tangerang Selatan",Rp1.500.000.000,2,57 m²,60 m²
Rumah Asri di Kedaung Ciputat,"Ciputat, Tangerang Selatan",Rp1.500.000.000,3,117 m²,202 m²
Rumah harus Laku cepat  di BSD,"Bumi Serpong Damai, Tangerang Selatan",Rp6.500.000.000,4,170 m²,300 m²
Discovery Alton Rumah Mewah 2 Lantai di Bintaro Jaya,"Bintaro, Tangerang Selatan",Rp9.335.000.000,4,152 m²,249 m²
Dijual Rumah Cantik Di Discovery Bintaro 5226,"Bintaro, Tangerang Selatan",Rp2.650.000.000,3,112 m²,105 m²
DIJUAL CEPAT  Rumah siap huni Alam Sutera  Cluster Sutera ORLANDA,"Alam Sutera, Tangerang Selatan",Rp6.600.000.000,4,247 m²,300 m²
Rumah Siap Huni Bisa Untuk Usaha Di Benda Baru Pamulang Mk12175,"Pamulang, Tangerang Selatan",Rp1.500.000.000,2,180 m²,97 m²
DIJUAL RUMAH CLUSTER LUXMORE DI GREENWICH BSD CITY,"Bumi Serpong Damai, Tangerang Selatan",Rp3.800.000.000,4,163 m²,135 m²
Dijual rumah di puri serpong,"Setu, Tangerang Selatan",Rp1.600.000.000,4,200 m²,72 m²
Cluster Kanade Rumah Mewah di BSD City,"Bumi Serpong Damai, Tangerang Selatan",Rp16.000.000.000,5,485 m²,328 m²
Rumah Pamulang Nanotown 4 Tangerang selatan 2 lantai baru nyaman,"Pamulang, Tangerang Selatan",Rp1.462.000.000,3,80 m²,72 m²
Discovery Aluvia Rumah Baru di Bintaro Jaya,"Bintaro, Tangerang Selatan",Rp3.436.000.000,3,110 m²,90 m²
"Rumah Exclusive ada Swimming Pool di Sektor 8 Bintaro Jaya,Hr 10294 Rd","Bintaro, Tangerang Selatan",Rp30.000.000.000,4,400 m²,1700 m²
Rumah  dijual di Nusa Loka BSD Siap Huni (HS87),"Bumi Serpong Damai, Tangerang Selatan",Rp2.800.000.000,5,180 m²,105 m²
Rumah mewah di Bintaro Jaya Sektor 9 (1991SF),"Bintaro, Tangerang Selatan",Rp6.200.000.000,7,160 m²,379 m²
Rumah dijual di Bintaro Sektor 9 Puri Bintaro,"Bintaro, Tangerang Selatan",Rp2.400.000.000,4,100 m²,120 m²
Dijual Cepat Rumah Asri Siap Huni di Pamulang,"Pamulang, Tangerang Selatan",Rp2.150.000.000,5,140 m²,427 m²
"Rumah Furnish Siap Huni di Pamulang Tangsel, Bisa Kpr Free Biaya","Pamulang, Tangerang Selatan",Rp1.560.000.000,2,65 m²,120 m²
Dijual rumah tinggal dikawasan Tangerang Selatan Pondok Aren,Tangerang Selatan,Rp8.500.000.000,4,250 m²,360 m²
"Rumah 2 Lantai Baru dan Mewah Dijual di Kencana Loka Sektor 12.3, BSD","Serpong, Tangerang Selatan",Rp4.500.000.000,4,300 m²,200 m²
"Rumah Super Murah Dijual di Villa Melati Mas, Serpong Utara","Serpong Utara, Tangerang Selatan",Rp1.900.000.000,3,180 m²,140 m²
Dijual Cepat Rumah 2 Lantai Berkonsep Bali di Kencana Loka BSD,"Bumi Serpong Damai, Tangerang Selatan",Rp1.850.000.000,3,108 m²,84 m²
Rumah Mewah American Classic Siap Huni Kebayoran Residence Bintaro,"Bintaro, Tangerang Selatan",Rp14.500.000.000,6,300 m²,323 m²
Dijual Cepat Rumah Baru Cantik DI Hook Kebayoran Sektor 7 Bintaro,"Bintaro, Tangerang Selatan",Rp4.500.000.000,3,187 m²,186 m²
Dijual Rumah Cantik Hook Luas 155 Sqm Dalam Cluster Sektor 9 Bintaro,"Bintaro, Tangerang Selatan",Rp2.600.000.000,3,120 m²,155 m²
Rumah di bsd lokasi strategis siap huni depan taman Kawasan Foresta,"Bumi Serpong Damai, Tangerang Selatan",Rp3.800.000.000,3,133 m²,180 m²
rumah di paradise Serpong city hanya 5 menit dari mall,"Pamulang, Tangerang Selatan",Rp1.500.000.000,4,85 m²,84 m²
Rumah Tanpa DP Serpong Minimalis Bebas Biaya KPR Kota Mandiri,"Serpong, Tangerang Selatan",Rp528.000.000,2,36 m²,60 m²
RUMAH MEWAH DI GADING SERPONG TANGERANG,"Bumi Serpong Damai, Tangerang Selatan",Rp12.000.000.000,5,450 m²,300 m²
"Rumah Kost 2 lantai, dekat Kampus Ternama",Tangerang Selatan,Rp2.600.000.000,14,200 m²,150 m²
dijual Rumah nyaman dan terawat siap huni di Serpong,"Serpong, Tangerang Selatan",Rp2.000.000.000,3,190 m²,162 m²
Cluster Enchante Residences di BSD City,"Bumi Serpong Damai, Tangerang Selatan",Rp31.000.000.000,5,760 m²,549 m²
Dijual Rumah 2 KT Siap Huni Di Bukit Indah Mk12208,"Ciputat, Tangerang Selatan",Rp3.000.000.000,2,140 m²,154 m²
Dijual Rumah Luas 168 Di Bukit Indah Ciputat Mk12207,"Ciputat, Tangerang Selatan",Rp1.300.000.000,6,198 m²,168 m²
Rumah Pondok Petir Renijaya dkt Unpam pamulang Ciputat,"Pamulang, Tangerang Selatan",Rp378.000.000,2,37 m²,64 m²
DIJUAL RUMAH DI CLUSTER BUKIT GOLF TERRACE BSD,"Bumi Serpong Damai, Tangerang Selatan",Rp18.500.000.000,5,900 m²,848 m²
Rumah Minimalis dan Asri di Ciputat Tangerang Selatan Banten,"Ciputat, Tangerang Selatan",Rp2.800.000.000,7,300 m²,359 m²
Dijual Rumah Green Serpong Bintaro Siap Huni,"Bintaro, Tangerang Selatan",Rp990.000.000,2,41 m²,72 m²
Rumah Asri Depan Taman di Griya Loka,"Bumi Serpong Damai, Tangerang Selatan",Rp1.800.000.000,4,135 m²,144 m²
Rumah 3 Lantai Dengan Attic Room Di Kawasan Sekitar Bintaro,"Ciputat, Tangerang Selatan",Rp3.400.000.000,4,163 m²,120 m²
Rumah 2 Lantai Cocok Untuk Pasutri Di Kawasan Sekitar Bintaro,"Ciputat, Tangerang Selatan",Rp1.400.000.000,2,57 m²,60 m²
Bagus Di Komplek Bersportclub Akses Sektor9,"Bintaro, Tangerang Selatan",Rp2.000.000.000,4,150 m²,236 m²
Rumah dijual Siap Huni di Permata Bintaro sektor 9 Tangsel,"Bintaro, Tangerang Selatan",Rp2.000.000.000,4,165 m²,120 m²
Rumah 3 Lantai Europe Style Di Kawasan Sekitar Bintaro,"Ciputat, Tangerang Selatan",Rp2.400.000.000,3,84 m²,110 m²
Rumah murah layton nava park bumi serpong damai di tangerang selatan,"Bumi Serpong Damai, Tangerang Selatan",Rp18.763.000.000,5,463 m²,300 m²
Dijual rumah lama  .alam sutera,"Alam Sutera, Tangerang Selatan",Rp2.200.000.000,3,65 m²,136 m²
DIJUAL RUMAH DI PERMATA BINTARO,Tangerang Selatan,Rp2.300.000.000,2,90 m²,168 m²
Rumah Hook Terawat & Siap Huni di Neo Permata Bintaro Sektor 9 (gb1420),"Bintaro, Tangerang Selatan",Rp2.300.000.000,3,90 m²,205 m²
Rumah dijual 2 lantai di Serpong dekat kantor walikota Tangsel,"Serpong Utara, Tangerang Selatan",Rp1.000.000.000,2,60 m²,59 m²
Dijual cepat rumah 2 lantai siap huni di Graha Raya Bintaro,"Serpong Utara, Tangerang Selatan",Rp1.650.000.000,3,107 m²,72 m²
Dijual Bintaro Jaya Cluster Taman Permata  Bintaro,Tangerang Selatan,Rp1.700.000.000,3,78 m²,108 m²
"Rumah Bagus, Baru Renovasi, 2 Lantai Di Kebayoran Residence Bintaro","Bintaro, Tangerang Selatan",Rp5.650.000.000,4,218 m²,254 m²
Rumah Idaman Dijual 10 Menit ke Gerbang Tol Pamulang Siap Huni J-16226,"Pamulang, Tangerang Selatan",Rp700.000.000,2,50 m²,47 m²
Rumah Dijual Brand New di Graha Bintaro Jaya,"Bintaro, Tangerang Selatan",Rp2.200.000.000,5,110 m²,98 m²
KEBAYORAN GARDEN BINTARO RUMAH HOMEY SIAP HUNI DISCOVERY EMERALD PURI,"Bintaro, Tangerang Selatan",Rp5.500.000.000,4,214 m²,246 m²
Rumah murah subsidi DP ukuran 6x11 di cluster Terravia BSD Tangerang,"Serpong, Tangerang Selatan",Rp2.790.000.000,5,144 m²,84 m²
"Di Jual Rumah Baru, Cluster Teraria 1 - Pamulang. Tangsel","Pamulang, Tangerang Selatan",Rp850.000.000,3,74 m²,78 m²
"Di jual Rumah Mewah The Mozia Cluster Amata - BSD City, TangSel","Serpong, Tangerang Selatan",Rp4.300.000.000,5,200 m²,160 m²
"Dijual Rumah Mewah di Villa Melati Mas - BSD City, Tangsel","Serpong Utara, Tangerang Selatan",Rp3.500.000.000,4,340 m²,240 m²
Dijual Rumah Mewah di Villa Melati Mas,"Serpong Utara, Tangerang Selatan",Rp2.800.000.000,5,155 m²,198 m²
Dijual Rumah Rapi Siap Huni 2 Lantai di Cendana Residence,"Pamulang, Tangerang Selatan",Rp1.250.000.000,3,90 m²,72 m²
Rumah siap huni rapih dan terawat di Graha Raya,"Serpong Utara, Tangerang Selatan",Rp1.250.000.000,2,72 m²,105 m²
Rumah Baru Aether Greenwich Park Unit Ready Siap Huni,"Bumi Serpong Damai, Tangerang Selatan",Rp3.450.000.000,3,165 m²,84 m²
Rumah  Hommy 2 Lantai Siap Huni di Puri Bintaro sektor 9 HR 12257,"Bintaro, Tangerang Selatan",Rp2.600.000.000,3,150 m²,120 m²
HOT SALE Rumah 2 Lantai Dalam Cluster Minimalis di Pondok Aren SC12243,"Bintaro, Tangerang Selatan",Rp2.400.000.000,4,220 m²,150 m²
EMERALD BINTARO RUMAH KEREN HOMIE DISCOVERY KEBAYORAN PURI,"Bintaro, Tangerang Selatan",Rp3.000.000.000,4,150 m²,138 m²
Rumah Cantik Sudah Renov di Emerald Garden Sektor 9 Bintaro GB-12192,"Bintaro, Tangerang Selatan",Rp2.450.000.000,2,105 m²,105 m²
HOT SALE Rumah Premium American Style di Mertilang Bintaro SC-10621,"Bintaro, Tangerang Selatan",Rp6.400.000.000,5,300 m²,241 m²
Rumah Hook Siap Huni Dikawasan Graha Raya Bintaro,"Bintaro, Tangerang Selatan",Rp2.400.000.000,2,80 m²,180 m²
VASYA   TANAKAYU | RUMAH 3 LANTAI FULL FURNISH TANPA DP,"Bumi Serpong Damai, Tangerang Selatan",Rp2.900.000.000,3,137 m²,84 m²
"jarang ada yang jual , siapa cepat dapat","Alam Sutera, Tangerang Selatan",Rp5.800.000.000,4,246 m²,240 m²
RUMAH 2 LANTAI HANYA 700 JUTAAN DI PAMULANG,"Pamulang, Tangerang Selatan",Rp700.000.000,3,70 m²,60 m²
Rumah Dijual Di Puri Bintaro Hijau Pondok Aren,Tangerang Selatan,Rp870.000.090,2,39 m²,72 m²
Rumah Dijual Dekat Setu Tangsel Full Furnished Siap Huni J-19799,"Setu, Tangerang Selatan",Rp1.500.000.000,2,80 m²,90 m²
150m2 Rumah Bagus Murah Untung Belakang Kampus STAN,Tangerang Selatan,Rp1.980.000.000,3,110 m²,150 m²
"Rumah 2 Lantai Bagus, Strategis Dan Bebas Banjir",Tangerang Selatan,Rp1.230.000.000,3,94 m²,72 m²
Rumah Bagus Murah Siap Huni Serpong Jaya t84m,"Serpong, Tangerang Selatan",Rp1.250.000.000,3,98 m²,84 m²
Rumah 2 Lantai Furnished Dekat Pintu Tol Pondok Aren Bintaro Siap Huni,"Sawah Lama, Tangerang Selatan",Rp1.350.000.000,4,90 m²,90 m²
Rumah Tanpa DP Serpong Free Biaya KPR Kota Mandiri,"Serpong, Tangerang Selatan",Rp750.000.000,3,57 m²,60 m²
"RUMAH LUX DALAM PERUMAHAN DI BINTARO, TANGERANG.","Bintaro, Tangerang Selatan",Rp1.750.000.000,4,150 m²,112 m²
Rumah Strategis Siap KPR Dekat Alam Sutera Harga All In J-10070,"Alam Sutera, Tangerang Selatan",Rp960.000.000,3,90 m²,103 m²
Jual Rumah Hook Depan Fasum Tmn Bermain Di Linea Graha Raya Bintaro,"Serpong Utara, Tangerang Selatan",Rp1.350.000.000,2,45 m²,60 m²
Dijual Rumah Cantik Dekat Akses Tol Di Sektor 9 Bintaro,"Bintaro, Tangerang Selatan",Rp2.800.000.000,3,117 m²,105 m²
Rumah 2 Lantai Modern Jual Cepat Terawat di Discovery Bintaro CW-5616,"Bintaro, Tangerang Selatan",Rp4.500.000.000,4,160 m²,150 m²
PERMATA ADORA BINTARO SEKTOR 9 RUMAH HOOK IDAMAN TITIHAN MALEO EMERALD,"Bintaro, Tangerang Selatan",Rp2.800.000.000,4,210 m²,135 m²
Jual rumah 3 lantai subsidi DP di Cluster Eonna BSD Tangerang Selatan,"Serpong, Tangerang Selatan",Rp5.667.000.000,5,255 m²,144 m²
Dijual Rumah Semi Furnished di Villa Bintaro Regency (3 M) 8397 oc,Tangerang Selatan,Rp3.000.000.000,3,200 m²,200 m²
DISCOVERY EOLA BINTARO RUMAH KEREN SIAP HUNI EMERALD KEBAYORAN PURI,"Bintaro, Tangerang Selatan",Rp3.850.000.000,4,165 m²,153 m²
"Rumah Hommy di Sarua Ciputat Tangerang Selatan (1,3 M) 12207 oc","Ciputat, Tangerang Selatan",Rp1.300.000.000,6,198 m²,168 m²
Dijual Rumah Di Kencana Loka BSD Tangerang Selatan,"Bumi Serpong Damai, Tangerang Selatan",Rp1.400.000.000,3,140 m²,84 m²
"Beli ini saja ya, GRAHA TARUMA - Cirendeu TangSel","Cirendeu, Tangerang Selatan",Rp1.922.221.850,3,100 m²,60 m²
Rumh dijual 3 Lantai di Emerald Semi Furnished,"Bintaro, Tangerang Selatan",Rp6.500.000.000,4,500 m²,189 m²
Rumah Dg Halaman Luas Bisa Untuk Swimming Pool Di Sektor 9. GB-11092DZ,"Bintaro, Tangerang Selatan",Rp5.500.000.000,4,200 m²,258 m²
Rumah Murah KPR Tanpa DP,"Serpong, Tangerang Selatan",Rp519.200.000,2,42 m²,60 m²
Dijual Rumah 2 Lantai dekat stasiun Rawa Buntu,"Pamulang, Tangerang Selatan",Rp959.000.000,3,70 m²,75 m²
"Rumah Cantik 3 Kamar Tidur, Siap Huni Ad Taman Di Sektor 9. GB-11025DZ","Bintaro, Tangerang Selatan",Rp4.500.000.000,3,106 m²,236 m²
Rumah Mungil Di Dalam Kompleks Bintaro Jaya Sektor 4,"Bintaro, Tangerang Selatan",Rp1.350.000.000,2,70 m²,90 m²
Jual Cepat Mayfield Greenwich BSD type 8 Siap Huni,"Bumi Serpong Damai, Tangerang Selatan",Rp3.250.000.000,3,130 m²,160 m²
Dijual Lelang Rumah di Pamulang Tangerang Selatan,"Pamulang Timur, Tangerang Selatan",Rp2.500.000.000,4,255 m²,135 m²
rumah dua lantai dekat kampus Atmaja BSD dan mall Aeon,"Serpong, Tangerang Selatan",Rp2.150.000.000,3,158 m²,105 m²
RUMAH MEWAH 2 LANTAI DI KOTA TANGERANG SELATAN,"Pamulang, Tangerang Selatan",Rp900.000.000,3,70 m²,60 m²
Rumah Siap Huni 2 lantai selangkah ke KRL mall BSD,"Serpong, Tangerang Selatan",Rp1.350.000.000,3,88 m²,78 m²
Rumah murah BSD dekat tol mall dan krl Furnish,"Serpong, Tangerang Selatan",Rp1.470.000.000,2,50 m²,84 m²
Rumah SHM Graha Raya Bintaro Furnish Bisa KPR Allin biaya biaya,"Bintaro, Tangerang Selatan",Rp1.690.000.000,2,80 m²,98 m²
dijual rumah murah 2 lantai di pamulang,"Pamulang, Tangerang Selatan",Rp750.000.000,3,70 m²,65 m²
Dijual Rumah SHM Villa Melati Mas Furnish Free Biaya sampai balik nama,"Serpong Utara, Tangerang Selatan",Rp1.990.000.000,3,103 m²,140 m²
Dijual cepat rumah cantik dalam cluster keamanan 24 jam dekat bintaro,"Bintaro, Tangerang Selatan",Rp2.950.000.000,3,161 m²,105 m²
Rumah Siap Huni Fully Furnished di Puri Bintaro sektor 9 SC 7858,"Bintaro, Tangerang Selatan",Rp3.100.000.000,4,160 m²,135 m²
Cluster Aman Minimalist Bintaro,"Bintaro, Tangerang Selatan",Rp2.400.000.000,3,80 m²,85 m²
"Di Jual Rumah Baru, Cluster Teraria 1 - Pamulang. Tangsel","Pamulang, Tangerang Selatan",Rp850.000.000,3,74 m²,78 m²
Dijual Rumah Mewah di Villa Melati Mas,"Serpong Utara, Tangerang Selatan",Rp2.800.000.000,5,155 m²,198 m²
"Di jual Rumah Mewah The Mozia Cluster Amata - BSD City, TangSel","Serpong, Tangerang Selatan",Rp4.300.000.000,5,200 m²,160 m²
Rumah Baru Aether Greenwich Park Unit Ready Siap Huni,"Bumi Serpong Damai, Tangerang Selatan",Rp3.450.000.000,3,165 m²,84 m²
Rumah canti siap huni Bintaro sektor 9,"Bintaro, Tangerang Selatan",Rp2.100.000.000,3,83 m²,72 m²
Dijual Cepat Rumah  Hook Siap Huni di Sektor 3A Bintaro,"Bintaro, Tangerang Selatan",Rp3.000.000.000,4,200 m²,200 m²
Dijual Rumah Minimalis Full Renovasi Lokasi Strategis Di Bintaro,"Bintaro, Tangerang Selatan",Rp6.100.000.000,5,300 m²,255 m²
Dijual Murah Rumah Hook Luas Asri dan Nyaman di Bintaro Jaya Sektor 3A,Tangerang Selatan,Rp3.000.000.000,4,110 m²,200 m²
Dijual Rumah Mewah Asri Nyaman Kolam Renang di Menteng Bintaro Jaya,Tangerang Selatan,Rp8.000.000.000,4,400 m²,320 m²
Di jual di Duta Bintaro,Tangerang Selatan,Rp895.000.000,2,72 m²,97 m²
Rumah Mewah Vineyard BSD,"Bumi Serpong Damai, Tangerang Selatan",Rp5.200.000.000,4,250 m²,205 m²
Dijual Rumah Giri Loka 3 Full Furnished,Tangerang Selatan,Rp5.000.000.000,4,250 m²,200 m²
Dijual Rumah Telaga Golf BSD,Tangerang Selatan,Rp3.700.000.000,3,198 m²,220 m²
Brand new house dalam proses finishing,"Bintaro, Tangerang Selatan",Rp4.250.000.000,3,200 m²,146 m²
di jual rumah lokasi cluater emerald,"Bintaro, Tangerang Selatan",Rp8.000.000.000,4,200 m²,308 m²
Jual sangat murah rumah terima rapi di Residence One-Bsd City,Tangerang Selatan,Rp2.200.000.000,3,110 m²,160 m²
Artha griya lestari rumah manis 5jt all in sampai akad.,"Bumi Serpong Damai, Tangerang Selatan",Rp900.000.000,3,65 m²,60 m²
Rumah 3 kamar tidur 2 kamar mandi di Tangerang Selatan,"Pamulang, Tangerang Selatan",Rp839.000.000,3,70 m²,60 m²
Di jual Rumah Di Pamulang  Magani Residence 5,"Pamulang, Tangerang Selatan",Rp800.000.000,3,70 m²,75 m²
Rumah Mungil Di Dalam Kompleks Bintaro Jaya Sektor 4,"Bintaro, Tangerang Selatan",Rp1.350.000.000,2,70 m²,90 m²
Dijual Rumah 2 Lantai dekat stasiun Rawa Buntu,"Pamulang, Tangerang Selatan",Rp959.000.000,3,70 m²,75 m²
dijual rumah murah 2 lantai di pamulang,"Pamulang, Tangerang Selatan",Rp750.000.000,3,70 m²,65 m²
Rumah murah BSD dekat tol mall dan krl Furnish,"Serpong, Tangerang Selatan",Rp1.470.000.000,2,50 m²,84 m²
Rumah Siap Huni 2 lantai selangkah ke KRL mall BSD,"Serpong, Tangerang Selatan",Rp1.350.000.000,3,88 m²,78 m²
RUMAH MEWAH 2 LANTAI DI KOTA TANGERANG SELATAN,"Pamulang, Tangerang Selatan",Rp900.000.000,3,70 m²,60 m²
Rumah SHM Graha Raya Bintaro Furnish Bisa KPR Allin biaya biaya,"Bintaro, Tangerang Selatan",Rp1.690.000.000,2,80 m²,98 m²
Dijual Rumah SHM Villa Melati Mas Furnish Free Biaya sampai balik nama,"Serpong Utara, Tangerang Selatan",Rp1.990.000.000,3,103 m²,140 m²
Rumah Dg Halaman Luas Bisa Untuk Swimming Pool Di Sektor 9. GB-11092DZ,"Bintaro, Tangerang Selatan",Rp5.500.000.000,4,200 m²,258 m²
Rumh dijual 3 Lantai di Emerald Semi Furnished,"Bintaro, Tangerang Selatan",Rp6.500.000.000,4,500 m²,189 m²
Rumah di Jual di Bintaro Dekat Dengan Stasiun Dan Bebas Banjir,"Bintaro, Tangerang Selatan",Rp1.400.000.000,3,66 m²,60 m²
PERMATA ADORA BINTARO SEKTOR 9 RUMAH HOOK IDAMAN TITIHAN MALEO EMERALD,"Bintaro, Tangerang Selatan",Rp2.800.000.000,4,210 m²,135 m²
Jual rumah 3 lantai subsidi DP di Cluster Eonna BSD Tangerang Selatan,"Serpong, Tangerang Selatan",Rp5.667.000.000,5,255 m²,144 m²
Dijual Rumah Strategis 2 Lantai dekat Stasiun Serpong Siap KPR J-13516,"Serpong, Tangerang Selatan",Rp1.340.000.000,3,144 m²,120 m²
Rumah Minimalis di Cluster Kencana dekat Living Plaza Pamulang KPR J-16270,"Ciputat, Tangerang Selatan",Rp910.000.000,2,100 m²,107 m²
Rumah Tangerang selatan cicilan mulai 4 Jutaan/bln.,"Pamulang, Tangerang Selatan",Rp823.000.000,2,39 m²,70 m²
DIJUAL RUMAH CANTIK DAN RAPI DI BSD,"Bumi Serpong Damai, Tangerang Selatan",Rp4.500.000.000,4,160 m²,241 m²
"Rumah cantik rapi siap huni di cluster elit BSD City, Tangsel icha","Bumi Serpong Damai, Tangerang Selatan",Rp3.600.000.000,5,216 m²,153 m²
Dijual rumah full furnish pamulang villa dago,"Pamulang, Tangerang Selatan",Rp1.000.000.000,2,65 m²,120 m²
"Rumah cantik minimalis modern siap huni di Bintaro 9, Tangsel V07","Bintaro, Tangerang Selatan",Rp7.500.000.000,5,240 m²,310 m²
Rumah 2 Lantai Bebas Biaya Di Pamulang Tangerang Selatan,"Pamulang, Tangerang Selatan",Rp888.300.000,3,69 m²,76 m²
"Rumah Siap Huni 2 kamar,2 lantai","Serpong, Tangerang Selatan",Rp1.000.000.000,2,60 m²,53 m²
